code,name,fullName,slug,type,provinceCode
00001,"Rạch Giá","Phường Rạch Giá, Tỉnh An Giang",rach-gia,ward,18
00002,"Dĩ An","Phường Dĩ An, Thành phố Hồ Chí Minh",di-an,ward,30
00003,"Hiệp Bình","Phường Hiệp Bình, Thành phố Hồ Chí Minh",hiep-binh,ward,30
00004,"Tăng Nhơn Phú","Phường Tăng Nhơn Phú, Thành phố Hồ Chí Minh",tang-nhon-phu,ward,30
00005,"Bà Điểm","Xã Bà Điểm, Thành phố Hồ Chí Minh",ba-iem,commune,30
00006,"Thanh Khê","Phường Thanh Khê, Thành phố Đà Nẵng",thanh-khe,ward,12
00007,"Hạc Thành","Phường Hạc Thành, Tỉnh Thanh Hoá",hac-thanh,ward,07
00008,"Trấn Biên","Phường Trấn Biên, Tỉnh Đồng Nai",tran-bien,ward,22
00009,"Chánh Hưng","Phường Chánh Hưng, Thành phố Hồ Chí Minh",chanh-hung,ward,30
00010,"Đông Thạnh","Xã Đông Thạnh, Thành phố Hồ Chí Minh",ong-thanh,commune,30
00011,"Nam Định","Phường Nam Định, Tỉnh Ninh Bình",nam-inh,ward,13
00012,"Bình Hưng Hòa","Phường Bình Hưng Hòa, Thành phố Hồ Chí Minh",binh-hung-hoa,ward,30
00013,"Hà Đông","Phường Hà Đông, Thành phố Hà Nội",ha-ong,ward,01
00014,"Bình Hưng","Xã Bình Hưng, Thành phố Hồ Chí Minh",binh-hung,commune,30
00015,"Đông Hưng Thuận","Phường Đông Hưng Thuận, Thành phố Hồ Chí Minh",ong-hung-thuan,ward,30
00016,"An Phú Đông","Phường An Phú Đông, Thành phố Hồ Chí Minh",an-phu-ong,ward,30
00017,"An Lạc","Phường An Lạc, Thành phố Hồ Chí Minh",an-lac,ward,30
00018,"Buôn Ma Thuột","Phường Buôn Ma Thuột, Tỉnh Đắk Lắk",buon-ma-thuot,ward,27
00019,"Long Bình","Phường Long Bình, Tỉnh Đồng Nai",long-binh,ward,22
00020,"Tân Thới Hiệp","Phường Tân Thới Hiệp, Thành phố Hồ Chí Minh",tan-thoi-hiep,ward,30
00021,"Vĩnh Lộc","Xã Vĩnh Lộc, Thành phố Hồ Chí Minh",vinh-loc,commune,30
00022,"Bình Trị Đông","Phường Bình Trị Đông, Thành phố Hồ Chí Minh",binh-tri-ong,ward,30
00023,"Tân Vĩnh Lộc","Xã Tân Vĩnh Lộc, Thành phố Hồ Chí Minh",tan-vinh-loc,commune,30
00024,"An Phú","Phường An Phú, Thành phố Hồ Chí Minh",an-phu,ward,30
00025,"Bình Tân","Phường Bình Tân, Thành phố Hồ Chí Minh",binh-tan,ward,30
00026,"Lê Chân","Phường Lê Chân, Thành phố Hải Phòng",le-chan,ward,05
00027,"Linh Xuân","Phường Linh Xuân, Thành phố Hồ Chí Minh",linh-xuan,ward,30
00028,"Phú Quốc","Đặc khu Phú Quốc, Tỉnh An Giang",phu-quoc,commune,18
00029,"Bình Đông","Phường Bình Đông, Thành phố Hồ Chí Minh",binh-ong,ward,30
00030,"Long Xuyên","Phường Long Xuyên, Tỉnh An Giang",long-xuyen,ward,18
00031,"Tân Hưng","Phường Tân Hưng, Thành phố Hồ Chí Minh",tan-hung,ward,30
00032,"Tam Bình","Phường Tam Bình, Thành phố Hồ Chí Minh",tam-binh,ward,30
00033,"Thạnh Mỹ Tây","Phường Thạnh Mỹ Tây, Thành phố Hồ Chí Minh",thanh-my-tay,ward,30
00034,"Thuận Giao","Phường Thuận Giao, Thành phố Hồ Chí Minh",thuan-giao,ward,30
00035,"Phú Định","Phường Phú Định, Thành phố Hồ Chí Minh",phu-inh,ward,30
00036,"Hoa Lư","Phường Hoa Lư, Tỉnh Ninh Bình",hoa-lu,ward,13
00037,"Tân Thuận","Phường Tân Thuận, Thành phố Hồ Chí Minh",tan-thuan,ward,30
00038,"Tân Hiệp","Phường Tân Hiệp, Thành phố Hồ Chí Minh",tan-hiep,ward,30
00039,"Trường Vinh","Phường Trường Vinh, Tỉnh Nghệ An",truong-vinh,ward,11
00040,"Phú Thọ Hòa","Phường Phú Thọ Hòa, Thành phố Hồ Chí Minh",phu-tho-hoa,ward,30
00041,"Tam Hiệp","Phường Tam Hiệp, Tỉnh Đồng Nai",tam-hiep,ward,22
00042,"Cao Lãnh","Phường Cao Lãnh, Tỉnh Đồng Tháp",cao-lanh,ward,16
00043,"Phước Long","Phường Phước Long, Thành phố Hồ Chí Minh",phuoc-long,ward,30
00044,"Tương Mai","Phường Tương Mai, Thành phố Hà Nội",tuong-mai,ward,01
00045,"Nha Trang","Phường Nha Trang, Tỉnh Khánh Hòa",nha-trang,ward,14
00046,"Bảy Hiền","Phường Bảy Hiền, Thành phố Hồ Chí Minh",bay-hien,ward,30
00047,"Đông Hòa","Phường Đông Hòa, Thành phố Hồ Chí Minh",ong-hoa,ward,30
00048,"Hải Châu","Phường Hải Châu, Thành phố Đà Nẵng",hai-chau,ward,12
00049,"Phú Xuân","Phường Phú Xuân, Thành phố Huế",phu-xuan,ward,04
00050,"Nam Nha Trang","Phường Nam Nha Trang, Tỉnh Khánh Hòa",nam-nha-trang,ward,14
00051,"Bạch Mai","Phường Bạch Mai, Thành phố Hà Nội",bach-mai,ward,01
00052,"Quy Nhơn","Phường Quy Nhơn, Tỉnh Gia Lai",quy-nhon,ward,28
00053,"Hạnh Thông","Phường Hạnh Thông, Thành phố Hồ Chí Minh",hanh-thong,ward,30
00054,"Củ Chi","Xã Củ Chi, Thành phố Hồ Chí Minh",cu-chi,commune,30
00055,"Bắc Nha Trang","Phường Bắc Nha Trang, Tỉnh Khánh Hòa",bac-nha-trang,ward,14
00056,"Trung Mỹ Tây","Phường Trung Mỹ Tây, Thành phố Hồ Chí Minh",trung-my-tay,ward,30
00057,"Tân Khánh","Phường Tân Khánh, Thành phố Hồ Chí Minh",tan-khanh,ward,30
00058,"Bình Thạnh","Phường Bình Thạnh, Thành phố Hồ Chí Minh",binh-thanh,ward,30
00059,"Tuy Hòa","Phường Tuy Hòa, Tỉnh Đắk Lắk",tuy-hoa,ward,27
00060,"Gia Định","Phường Gia Định, Thành phố Hồ Chí Minh",gia-inh,ward,30
00061,"Nhà Bè","Xã Nhà Bè, Thành phố Hồ Chí Minh",nha-be,commune,30
00062,"Thới An","Phường Thới An, Thành phố Hồ Chí Minh",thoi-an,ward,30
00063,"Nghĩa Đô","Phường Nghĩa Đô, Thành phố Hà Nội",nghia-o,ward,01
00064,"An Hội Đông","Phường An Hội Đông, Thành phố Hồ Chí Minh",an-hoi-ong,ward,30
00065,"Thành Vinh","Phường Thành Vinh, Tỉnh Nghệ An",thanh-vinh,ward,11
00066,"Hồng Hà","Phường Hồng Hà, Thành phố Hà Nội",hong-ha,ward,01
00067,"Bắc Giang","Phường Bắc Giang, Tỉnh Bắc Ninh",bac-giang,ward,10
00068,"Bình Trưng","Phường Bình Trưng, Thành phố Hồ Chí Minh",binh-trung,ward,30
00069,"Thông Tây Hội","Phường Thông Tây Hội, Thành phố Hồ Chí Minh",thong-tay-hoi,ward,30
00070,"An Hội Tây","Phường An Hội Tây, Thành phố Hồ Chí Minh",an-hoi-tay,ward,30
00071,"Bình Hòa","Phường Bình Hòa, Thành phố Hồ Chí Minh",binh-hoa,ward,30
00072,"Bồ Đề","Phường Bồ Đề, Thành phố Hà Nội",bo-e,ward,01
00073,"Từ Liêm","Phường Từ Liêm, Thành phố Hà Nội",tu-liem,ward,01
00074,"Long Bình","Phường Long Bình, Thành phố Hồ Chí Minh",long-binh,ward,30
00075,"Ninh Kiều","Phường Ninh Kiều, Thành phố Cần Thơ",ninh-kieu,ward,32
00076,"Hòa Cường","Phường Hòa Cường, Thành phố Đà Nẵng",hoa-cuong,ward,12
00077,"Thủ Đức","Phường Thủ Đức, Thành phố Hồ Chí Minh",thu-uc,ward,30
00078,"Lái Thiêu","Phường Lái Thiêu, Thành phố Hồ Chí Minh",lai-thieu,ward,30
00079,"Đông Anh","Xã Đông Anh, Thành phố Hà Nội",ong-anh,commune,01
00080,"Sóc Sơn","Xã Sóc Sơn, Thành phố Hà Nội",soc-son,commune,01
00081,"Vũng Tàu","Phường Vũng Tàu, Thành phố Hồ Chí Minh",vung-tau,ward,30
00082,"Tân Sơn Nhì","Phường Tân Sơn Nhì, Thành phố Hồ Chí Minh",tan-son-nhi,ward,30
00083,"Bình Lợi Trung","Phường Bình Lợi Trung, Thành phố Hồ Chí Minh",binh-loi-trung,ward,30
00084,"An Biên","Phường An Biên, Thành phố Hải Phòng",an-bien,ward,05
00085,"Ngũ Hành Sơn","Phường Ngũ Hành Sơn, Thành phố Đà Nẵng",ngu-hanh-son,ward,12
00086,"Tân Nhựt","Xã Tân Nhựt, Thành phố Hồ Chí Minh",tan-nhut,commune,30
00087,"An Nhơn","Phường An Nhơn, Thành phố Hồ Chí Minh",an-nhon,ward,30
00088,"Tân Tạo","Phường Tân Tạo, Thành phố Hồ Chí Minh",tan-tao,ward,30
00089,"Hồng Bàng","Phường Hồng Bàng, Thành phố Hải Phòng",hong-bang,ward,05
00090,"Hòa Khánh","Phường Hòa Khánh, Thành phố Đà Nẵng",hoa-khanh,ward,12
00091,"Phù Đổng","Xã Phù Đổng, Thành phố Hà Nội",phu-ong,commune,01
00092,"Phan Đình Phùng","Phường Phan Đình Phùng, Tỉnh Thái Nguyên",phan-inh-phung,ward,19
00093,"Bình Phước","Phường Bình Phước, Tỉnh Đồng Nai",binh-phuoc,ward,22
00094,"Gò Vấp","Phường Gò Vấp, Thành phố Hồ Chí Minh",go-vap,ward,30
00095,"Long Hải","Xã Long Hải, Thành phố Hồ Chí Minh",long-hai,commune,30
00096,"Kim Liên","Phường Kim Liên, Thành phố Hà Nội",kim-lien,ward,01
00097,"Tây Nha Trang","Phường Tây Nha Trang, Tỉnh Khánh Hòa",tay-nha-trang,ward,14
00098,"Phú Lợi","Phường Phú Lợi, Thành phố Hồ Chí Minh",phu-loi,ward,30
00099,"Bình Dương","Phường Bình Dương, Thành phố Hồ Chí Minh",binh-duong,ward,30
00100,"Long An","Phường Long An, Tỉnh Tây Ninh",long-an,ward,15
00101,"Thanh Xuân","Phường Thanh Xuân, Thành phố Hà Nội",thanh-xuan,ward,01
00102,"Long Hoa","Phường Long Hoa, Tỉnh Tây Ninh",long-hoa,ward,15
00103,"Văn Miếu - Quốc Tử Giám","Phường Văn Miếu - Quốc Tử Giám, Thành phố Hà Nội",van-mieu-quoc-tu-giam,ward,01
00104,"Hoàn Kiếm","Phường Hoàn Kiếm, Thành phố Hà Nội",hoan-kiem,ward,01
00105,"Trảng Dài","Phường Trảng Dài, Tỉnh Đồng Nai",trang-dai,ward,22
00106,"Xuân Phương","Phường Xuân Phương, Thành phố Hà Nội",xuan-phuong,ward,01
00107,"Sa Đéc","Phường Sa Đéc, Tỉnh Đồng Tháp",sa-ec,ward,16
00108,"Xuân Lộc","Xã Xuân Lộc, Tỉnh Đồng Nai",xuan-loc,commune,22
00109,"Vườn Lài","Phường Vườn Lài, Thành phố Hồ Chí Minh",vuon-lai,ward,30
00110,"Phú Thạnh","Phường Phú Thạnh, Thành phố Hồ Chí Minh",phu-thanh,ward,30
00111,"Xuân Thới Sơn","Xã Xuân Thới Sơn, Thành phố Hồ Chí Minh",xuan-thoi-son,commune,30
00112,"Xuân Hương - Đà Lạt","Phường Xuân Hương - Đà Lạt, Tỉnh Lâm Đồng",xuan-huong-a-lat,ward,29
00113,"Hải An","Phường Hải An, Thành phố Hải Phòng",hai-an,ward,05
00114,"Thư Lâm","Xã Thư Lâm, Thành phố Hà Nội",thu-lam,commune,01
00115,"Gia Viên","Phường Gia Viên, Thành phố Hải Phòng",gia-vien,ward,05
00116,"An Khánh","Xã An Khánh, Thành phố Hà Nội",an-khanh,commune,01
00117,"Tân Triều","Phường Tân Triều, Tỉnh Đồng Nai",tan-trieu,ward,22
00118,"Tân Đông Hiệp","Phường Tân Đông Hiệp, Thành phố Hồ Chí Minh",tan-ong-hiep,ward,30
00119,"Tây Hồ","Phường Tây Hồ, Thành phố Hà Nội",tay-ho,ward,01
00120,"Tây Phương","Xã Tây Phương, Thành phố Hà Nội",tay-phuong,commune,01
00121,"Sầm Sơn","Phường Sầm Sơn, Tỉnh Thanh Hoá",sam-son,ward,07
00122,"Bình Mỹ","Xã Bình Mỹ, Thành phố Hồ Chí Minh",binh-my,commune,30
00123,"Thuận Hóa","Phường Thuận Hóa, Thành phố Huế",thuan-hoa,ward,04
00124,"Hoàng Mai","Phường Hoàng Mai, Thành phố Hà Nội",hoang-mai,ward,01
00125,"Bến Cát","Phường Bến Cát, Thành phố Hồ Chí Minh",ben-cat,ward,30
00126,"Phú Hòa Đông","Xã Phú Hòa Đông, Thành phố Hồ Chí Minh",phu-hoa-ong,commune,30
00127,"Ô Diên","Xã Ô Diên, Thành phố Hà Nội",o-dien,commune,01
00128,"Châu Đốc","Phường Châu Đốc, Tỉnh An Giang",chau-oc,ward,18
00129,"Giảng Võ","Phường Giảng Võ, Thành phố Hà Nội",giang-vo,ward,01
00130,"Phú Xuyên","Xã Phú Xuyên, Thành phố Hà Nội",phu-xuyen,commune,01
00131,"Hòa Hưng","Phường Hòa Hưng, Thành phố Hồ Chí Minh",hoa-hung,ward,30
00132,"Phúc Thịnh","Xã Phúc Thịnh, Thành phố Hà Nội",phuc-thinh,commune,01
00133,"Phú Lợi","Phường Phú Lợi, Thành phố Cần Thơ",phu-loi,ward,32
00134,"Khánh Hội","Phường Khánh Hội, Thành phố Hồ Chí Minh",khanh-hoi,ward,30
00135,"An Khê","Phường An Khê, Thành phố Đà Nẵng",an-khe,ward,12
00136,"Ngọc Hà","Phường Ngọc Hà, Thành phố Hà Nội",ngoc-ha,ward,01
00137,"Tân Hòa","Phường Tân Hòa, Thành phố Hồ Chí Minh",tan-hoa,ward,30
00138,"Hóc Môn","Xã Hóc Môn, Thành phố Hồ Chí Minh",hoc-mon,commune,30
00139,"Tân Phú","Phường Tân Phú, Thành phố Hồ Chí Minh",tan-phu,ward,30
00140,"Long Thành","Xã Long Thành, Tỉnh Đồng Nai",long-thanh,commune,22
00141,"Trảng Bom","Xã Trảng Bom, Tỉnh Đồng Nai",trang-bom,commune,22
00142,"Đại Thanh","Xã Đại Thanh, Thành phố Hà Nội",ai-thanh,commune,01
00143,"Trần Lãm","Phường Trần Lãm, Tỉnh Hưng Yên",tran-lam,ward,02
00144,"Bình Tiên","Phường Bình Tiên, Thành phố Hồ Chí Minh",binh-tien,ward,30
00145,"Thành Sen","Phường Thành Sen, Tỉnh Hà Tĩnh",thanh-sen,ward,17
00146,"Minh Phụng","Phường Minh Phụng, Thành phố Hồ Chí Minh",minh-phung,ward,30
00147,"Vĩnh Tuy","Phường Vĩnh Tuy, Thành phố Hà Nội",vinh-tuy,ward,01
00148,"Gia Lâm","Xã Gia Lâm, Thành phố Hà Nội",gia-lam,commune,01
00149,"Hiệp Hoà","Xã Hiệp Hoà, Tỉnh Bắc Ninh",hiep-hoa,commune,10
00150,"Tân Bình","Phường Tân Bình, Thành phố Hồ Chí Minh",tan-binh,ward,30
00151,"Tân Ninh","Phường Tân Ninh, Tỉnh Tây Ninh",tan-ninh,ward,15
00152,"Bình Sơn","Xã Bình Sơn, Tỉnh Quảng Ngãi",binh-son,commune,23
00153,"Nhơn Mỹ","Xã Nhơn Mỹ, Tỉnh An Giang",nhon-my,commune,18
00154,"Ngô Quyền","Phường Ngô Quyền, Thành phố Hải Phòng",ngo-quyen,ward,05
00155,"Thủ Dầu Một","Phường Thủ Dầu Một, Thành phố Hồ Chí Minh",thu-dau-mot,ward,30
00156,"Nhiêu Lộc","Phường Nhiêu Lộc, Thành phố Hồ Chí Minh",nhieu-loc,ward,30
00157,"Ea Kar","Xã Ea Kar, Tỉnh Đắk Lắk",ea-kar,commune,27
00158,"Chương Mỹ","Phường Chương Mỹ, Thành phố Hà Nội",chuong-my,ward,01
00159,"Hai Bà Trưng","Phường Hai Bà Trưng, Thành phố Hà Nội",hai-ba-trung,ward,01
00160,"Phú Lâm","Phường Phú Lâm, Thành phố Hồ Chí Minh",phu-lam,ward,30
00161,"Sơn Trà","Phường Sơn Trà, Thành phố Đà Nẵng",son-tra,ward,12
00162,"Phan Rí Cửa","Xã Phan Rí Cửa, Tỉnh Lâm Đồng",phan-ri-cua,commune,29
00163,"Cam Lâm","Xã Cam Lâm, Tỉnh Khánh Hòa",cam-lam,commune,14
00164,"Tam Thắng","Phường Tam Thắng, Thành phố Hồ Chí Minh",tam-thang,ward,30
00165,"Khương Đình","Phường Khương Đình, Thành phố Hà Nội",khuong-inh,ward,01
00166,"Tân An","Phường Tân An, Thành phố Cần Thơ",tan-an,ward,32
00167,"Hòa Xuân","Phường Hòa Xuân, Thành phố Đà Nẵng",hoa-xuan,ward,12
00168,"Định Quán","Xã Định Quán, Tỉnh Đồng Nai",inh-quan,commune,22
00169,"Định Công","Phường Định Công, Thành phố Hà Nội",inh-cong,ward,01
00170,"Phan Thiết","Phường Phan Thiết, Tỉnh Lâm Đồng",phan-thiet,ward,29
00171,"Đức Trọng","Xã Đức Trọng, Tỉnh Lâm Đồng",uc-trong,commune,29
00172,"Chợ Lớn","Phường Chợ Lớn, Thành phố Hồ Chí Minh",cho-lon,ward,30
00173,"Tân Sơn Nhất","Phường Tân Sơn Nhất, Thành phố Hồ Chí Minh",tan-son-nhat,ward,30
00174,"Tân An Hội","Xã Tân An Hội, Thành phố Hồ Chí Minh",tan-an-hoi,commune,30
00175,"Kinh Bắc","Phường Kinh Bắc, Tỉnh Bắc Ninh",kinh-bac,ward,10
00176,"Đại Đồng","Xã Đại Đồng, Tỉnh Bắc Ninh",ai-ong,commune,10
00177,"Đồng Hới","Phường Đồng Hới, Tỉnh Quảng Trị",ong-hoi,ward,03
00178,"Phú Thuận","Phường Phú Thuận, Thành phố Hồ Chí Minh",phu-thuan,ward,30
00179,"Tân Thành","Phường Tân Thành, Tỉnh Cà Mau",tan-thanh,ward,33
00180,"Đa Phúc","Xã Đa Phúc, Thành phố Hà Nội",a-phuc,commune,01
00181,"Đông Ngạc","Phường Đông Ngạc, Thành phố Hà Nội",ong-ngac,ward,01
00182,"Bình Minh","Xã Bình Minh, Tỉnh Đồng Nai",binh-minh,commune,22
00183,"Việt Hưng","Phường Việt Hưng, Thành phố Hà Nội",viet-hung,ward,01
00184,"An Hải","Phường An Hải, Thành phố Đà Nẵng",an-hai,ward,12
00185,"Phương Liệt","Phường Phương Liệt, Thành phố Hà Nội",phuong-liet,ward,01
00186,"Lê Thanh Nghị","Phường Lê Thanh Nghị, Thành phố Hải Phòng",le-thanh-nghi,ward,05
00187,"Đống Đa","Phường Đống Đa, Thành phố Hà Nội",ong-a,ward,01
00188,"An Xuyên","Phường An Xuyên, Tỉnh Cà Mau",an-xuyen,ward,33
00189,"An Đông","Phường An Đông, Thành phố Hồ Chí Minh",an-ong,ward,30
00190,"Chợ Mới","Xã Chợ Mới, Tỉnh An Giang",cho-moi,commune,18
00191,"Lai Vung","Xã Lai Vung, Tỉnh Đồng Tháp",lai-vung,commune,16
00192,"Đại Mỗ","Phường Đại Mỗ, Thành phố Hà Nội",ai-mo,ward,01
00193,"Bình Minh","Xã Bình Minh, Thành phố Hà Nội",binh-minh,commune,01
00194,"Hòa Lợi","Phường Hòa Lợi, Thành phố Hồ Chí Minh",hoa-loi,ward,30
00195,"Thới Hòa","Phường Thới Hòa, Thành phố Hồ Chí Minh",thoi-hoa,ward,30
00196,"Pleiku","Phường Pleiku, Tỉnh Gia Lai",pleiku,ward,28
00197,"Gia Kiệm","Xã Gia Kiệm, Tỉnh Đồng Nai",gia-kiem,commune,22
00198,"Hố Nai","Phường Hố Nai, Tỉnh Đồng Nai",ho-nai,ward,22
00199,"Cẩm Lệ","Phường Cẩm Lệ, Thành phố Đà Nẵng",cam-le,ward,12
00200,"Cầu Ông Lãnh","Phường Cầu Ông Lãnh, Thành phố Hồ Chí Minh",cau-ong-lanh,ward,30
00201,"Phú Mỹ","Phường Phú Mỹ, Thành phố Hồ Chí Minh",phu-my,ward,30
00202,"Hoà Bình","Phường Hoà Bình, Tỉnh Phú Thọ",hoa-binh,ward,06
00203,"Nhơn Trạch","Xã Nhơn Trạch, Tỉnh Đồng Nai",nhon-trach,commune,22
00204,"Xuân Hòa","Xã Xuân Hòa, Tỉnh Đồng Nai",xuan-hoa,commune,22
00205,"Vĩnh Phúc","Phường Vĩnh Phúc, Tỉnh Phú Thọ",vinh-phuc,ward,06
00206,"Cần Giuộc","Xã Cần Giuộc, Tỉnh Tây Ninh",can-giuoc,commune,15
00207,"Như Quỳnh","Xã Như Quỳnh, Tỉnh Hưng Yên",nhu-quynh,commune,02
00208,"Quảng Phú","Phường Quảng Phú, Tỉnh Thanh Hoá",quang-phu,ward,07
00209,"Kon Tum","Phường Kon Tum, Tỉnh Quảng Ngãi",kon-tum,ward,23
00210,"Tuy Phước","Xã Tuy Phước, Tỉnh Gia Lai",tuy-phuoc,commune,28
00211,"Tân Sơn","Phường Tân Sơn, Thành phố Hồ Chí Minh",tan-son,ward,30
00212,"An Hải","Phường An Hải, Thành phố Hải Phòng",an-hai,ward,05
00213,"Long Khánh","Phường Long Khánh, Tỉnh Đồng Nai",long-khanh,ward,22
00214,"Yên Hòa","Phường Yên Hòa, Thành phố Hà Nội",yen-hoa,ward,01
00215,"Lào Cai","Phường Lào Cai, Tỉnh Lào Cai",lao-cai,ward,09
00216,"An Khánh","Phường An Khánh, Thành phố Hồ Chí Minh",an-khanh,ward,30
00217,"An Dương","Phường An Dương, Thành phố Hải Phòng",an-duong,ward,05
00218,"Tân Phú","Xã Tân Phú, Tỉnh Đồng Nai",tan-phu,commune,22
00219,"Tân Long","Xã Tân Long, Tỉnh Đồng Tháp",tan-long,commune,16
00220,"Bình Thới","Phường Bình Thới, Thành phố Hồ Chí Minh",binh-thoi,ward,30
00221,"Rạch Dừa","Phường Rạch Dừa, Thành phố Hồ Chí Minh",rach-dua,ward,30
00222,"Thanh Liệt","Phường Thanh Liệt, Thành phố Hà Nội",thanh-liet,ward,01
00223,"Bình Chánh","Xã Bình Chánh, Thành phố Hồ Chí Minh",binh-chanh,commune,30
00224,"Tân Phước 3","Xã Tân Phước 3, Tỉnh Đồng Tháp",tan-phuoc-3,commune,16
00225,"Bình Phú","Phường Bình Phú, Thành phố Hồ Chí Minh",binh-phu,ward,30
00226,"Yên Mỹ","Xã Yên Mỹ, Tỉnh Hưng Yên",yen-my,commune,02
00227,"Diên Hồng","Phường Diên Hồng, Thành phố Hồ Chí Minh",dien-hong,ward,30
00228,"Phúc Thọ","Xã Phúc Thọ, Thành phố Hà Nội",phuc-tho,commune,01
00229,"Biên Hòa","Phường Biên Hòa, Tỉnh Đồng Nai",bien-hoa,ward,22
00230,"Đại Xuyên","Xã Đại Xuyên, Thành phố Hà Nội",ai-xuyen,commune,01
00231,"Phú Diễn","Phường Phú Diễn, Thành phố Hà Nội",phu-dien,ward,01
00232,"Thiên Lộc","Xã Thiên Lộc, Thành phố Hà Nội",thien-loc,commune,01
00233,"Cầu Giấy","Phường Cầu Giấy, Thành phố Hà Nội",cau-giay,ward,01
00234,"Vinh Phú","Phường Vinh Phú, Tỉnh Nghệ An",vinh-phu,ward,11
00235,"Long Hưng","Phường Long Hưng, Tỉnh Đồng Nai",long-hung,ward,22
00236,"Hội An","Xã Hội An, Tỉnh An Giang",hoi-an,commune,18
00237,"Lấp Vò","Xã Lấp Vò, Tỉnh Đồng Tháp",lap-vo,commune,16
00238,"Xuân Cẩm","Xã Xuân Cẩm, Tỉnh Bắc Ninh",xuan-cam,commune,10
00239,"Long Trường","Phường Long Trường, Thành phố Hồ Chí Minh",long-truong,ward,30
00240,"Quỳnh Lưu","Xã Quỳnh Lưu, Tỉnh Nghệ An",quynh-luu,commune,11
00241,"Nghĩa Lộ","Phường Nghĩa Lộ, Tỉnh Quảng Ngãi",nghia-lo,ward,23
00242,"Ô Môn","Phường Ô Môn, Thành phố Cần Thơ",o-mon,ward,32
00243,"Đạo Thạnh","Phường Đạo Thạnh, Tỉnh Đồng Tháp",ao-thanh,ward,16
00244,"Tân Lập","Phường Tân Lập, Tỉnh Đắk Lắk",tan-lap,ward,27
00245,"Quy Nhơn Nam","Phường Quy Nhơn Nam, Tỉnh Gia Lai",quy-nhon-nam,ward,28
00246,"Tân Uyên","Phường Tân Uyên, Thành phố Hồ Chí Minh",tan-uyen,ward,30
00247,"Việt Trì","Phường Việt Trì, Tỉnh Phú Thọ",viet-tri,ward,06
00248,"Bình Đức","Phường Bình Đức, Tỉnh An Giang",binh-uc,ward,18
00249,"Tây Thạnh","Phường Tây Thạnh, Thành phố Hồ Chí Minh",tay-thanh,ward,30
00250,"Điện Bàn Đông","Phường Điện Bàn Đông, Thành phố Đà Nẵng",ien-ban-ong,ward,12
00251,"Phan Rang","Phường Phan Rang, Tỉnh Khánh Hòa",phan-rang,ward,14
00252,"Hát Môn","Xã Hát Môn, Thành phố Hà Nội",hat-mon,commune,01
00253,"Quỳnh Phú","Xã Quỳnh Phú, Tỉnh Nghệ An",quynh-phu,commune,11
00254,"Mạo Khê","Phường Mạo Khê, Tỉnh Quảng Ninh",mao-khe,ward,08
00255,"Minh Xuân","Phường Minh Xuân, Tỉnh Tuyên Quang",minh-xuan,ward,34
00256,"Dầu Giây","Xã Dầu Giây, Tỉnh Đồng Nai",dau-giay,commune,22
00257,"Bến Thành","Phường Bến Thành, Thành phố Hồ Chí Minh",ben-thanh,ward,30
00258,"Thuỷ Nguyên","Phường Thuỷ Nguyên, Thành phố Hải Phòng",thuy-nguyen,ward,05
00259,"Hợp Thịnh","Xã Hợp Thịnh, Tỉnh Bắc Ninh",hop-thinh,commune,10
00260,"Thống Nhất","Xã Thống Nhất, Tỉnh Đồng Nai",thong-nhat,commune,22
00261,"Xuân Trường","Xã Xuân Trường, Tỉnh Ninh Bình",xuan-truong,commune,13
00262,"Phong Hòa","Xã Phong Hòa, Tỉnh Đồng Tháp",phong-hoa,commune,16
00263,"Hưng Long","Xã Hưng Long, Thành phố Hồ Chí Minh",hung-long,commune,30
00264,"Đức Nhuận","Phường Đức Nhuận, Thành phố Hồ Chí Minh",uc-nhuan,ward,30
00265,"An Phú","Xã An Phú, Tỉnh Quảng Ngãi",an-phu,commune,23
00266,"Lâm Viên - Đà Lạt","Phường Lâm Viên - Đà Lạt, Tỉnh Lâm Đồng",lam-vien-a-lat,ward,29
00267,"Yên Lãng","Xã Yên Lãng, Thành phố Hà Nội",yen-lang,commune,01
00268,"Sơn Tây","Phường Sơn Tây, Thành phố Hà Nội",son-tay,ward,01
00269,"Ô Chợ Dừa","Phường Ô Chợ Dừa, Thành phố Hà Nội",o-cho-dua,ward,01
00270,"Phú Tân","Xã Phú Tân, Tỉnh An Giang",phu-tan,commune,18
00271,"Cát Hải","Đặc khu Cát Hải, Thành phố Hải Phòng",cat-hai,commune,05
00272,"Cái Răng","Phường Cái Răng, Thành phố Cần Thơ",cai-rang,ward,32
00273,"Phú Nghĩa","Xã Phú Nghĩa, Thành phố Hà Nội",phu-nghia,commune,01
00274,"Kiến Hưng","Phường Kiến Hưng, Thành phố Hà Nội",kien-hung,ward,01
00275,"Thường Tín","Xã Thường Tín, Thành phố Hà Nội",thuong-tin,commune,01
00276,"Liên Hương","Xã Liên Hương, Tỉnh Lâm Đồng",lien-huong,commune,29
00277,"Cổ Đô","Xã Cổ Đô, Thành phố Hà Nội",co-o,commune,01
00278,"Liên Chiểu","Phường Liên Chiểu, Thành phố Đà Nẵng",lien-chieu,ward,12
00279,"Vạn Lộc","Xã Vạn Lộc, Tỉnh Thanh Hoá",van-loc,commune,07
00280,"Trung An","Phường Trung An, Tỉnh Đồng Tháp",trung-an,ward,16
00281,"Nội Bài","Xã Nội Bài, Thành phố Hà Nội",noi-bai,commune,01
00282,"Yên Bái","Phường Yên Bái, Tỉnh Lào Cai",yen-bai,ward,09
00283,"Giồng Riềng","Xã Giồng Riềng, Tỉnh An Giang",giong-rieng,commune,18
00284,"Cù Lao Giêng","Xã Cù Lao Giêng, Tỉnh An Giang",cu-lao-gieng,commune,18
00285,"Ninh Phước","Xã Ninh Phước, Tỉnh Khánh Hòa",ninh-phuoc,commune,14
00286,"Châu Thành","Xã Châu Thành, Tỉnh An Giang",chau-thanh,commune,18
00287,"Trường Thi","Phường Trường Thi, Tỉnh Ninh Bình",truong-thi,ward,13
00288,"Quang Minh","Xã Quang Minh, Thành phố Hà Nội",quang-minh,commune,01
00289,"Hòa Xá","Xã Hòa Xá, Thành phố Hà Nội",hoa-xa,commune,01
00290,"Núi Thành","Xã Núi Thành, Thành phố Đà Nẵng",nui-thanh,commune,12
00291,"Hoà Bình","Phường Hoà Bình, Thành phố Hồ Chí Minh",hoa-binh,ward,30
00292,"Hoài Đức","Xã Hoài Đức, Thành phố Hà Nội",hoai-uc,commune,01
00293,"Phố Hiến","Phường Phố Hiến, Tỉnh Hưng Yên",pho-hien,ward,02
00294,"Chư Sê","Xã Chư Sê, Tỉnh Gia Lai",chu-se,commune,28
00295,"Hòa Long","Xã Hòa Long, Tỉnh Đồng Tháp",hoa-long,commune,16
00296,"Krông Pắc","Xã Krông Pắc, Tỉnh Đắk Lắk",krong-pac,commune,27
00297,"Cát Lái","Phường Cát Lái, Thành phố Hồ Chí Minh",cat-lai,ward,30
00298,"Bình Mỹ","Xã Bình Mỹ, Tỉnh An Giang",binh-my,commune,18
00299,"Phú Hựu","Xã Phú Hựu, Tỉnh Đồng Tháp",phu-huu,commune,16
00300,"Vĩnh Châu","Phường Vĩnh Châu, Thành phố Cần Thơ",vinh-chau,ward,32
00301,"Phú Nhuận","Phường Phú Nhuận, Thành phố Hồ Chí Minh",phu-nhuan,ward,30
00302,"Thuận An","Xã Thuận An, Thành phố Hà Nội",thuan-an,commune,01
00303,"Tân Mỹ","Phường Tân Mỹ, Thành phố Hồ Chí Minh",tan-my,ward,30
