code,name,fullName,slug,type,provinceCode
01598,"Thăng Bình","Xã Thăng Bình, Tỉnh Thanh Hoá",thang-binh,commune,07
01599,"Võ Miếu","Xã Võ Miếu, Tỉnh Phú Thọ",vo-mieu,commune,06
01600,"Quách Phẩm","Xã Quách Phẩm, Tỉnh Cà Mau",quach-pham,commune,33
01601,"Đan Thượng","Xã Đan Thượng, Tỉnh Phú Thọ",an-thuong,commune,06
01602,"Tuyên Quang","Xã Tuyên Quang, Tỉnh Lâm Đồng",tuyen-quang,commune,29
01603,"Ba Đồn","Phường Ba Đồn, Tỉnh Quảng Trị",ba-on,ward,03
01604,"Cuôr Đăng","Xã Cuôr Đăng, Tỉnh Đắk Lắk",cuor-ang,commune,27
01605,"Đốc Binh Kiều","Xã Đốc Binh Kiều, Tỉnh Đồng Tháp",oc-binh-kieu,commune,16
01606,"Ea Rốk","Xã Ea Rốk, Tỉnh Đắk Lắk",ea-rok,commune,27
01607,"An Thành","Xã An Thành, Thành phố Hải Phòng",an-thanh,commune,05
01608,"Tân Tiến","Xã Tân Tiến, Tỉnh Đắk Lắk",tan-tien,commune,27
01609,"Phù Mỹ Bắc","Xã Phù Mỹ Bắc, Tỉnh Gia Lai",phu-my-bac,commune,28
01610,"Hà Huy Tập","Phường Hà Huy Tập, Tỉnh Hà Tĩnh",ha-huy-tap,ward,17
01611,"Tống Sơn","Xã Tống Sơn, Tỉnh Thanh Hoá",tong-son,commune,07
01612,"Bắc Hồng Lĩnh","Phường Bắc Hồng Lĩnh, Tỉnh Hà Tĩnh",bac-hong-linh,ward,17
01613,"Lai Thành","Xã Lai Thành, Tỉnh Ninh Bình",lai-thanh,commune,13
01614,"An Nông","Xã An Nông, Tỉnh Thanh Hoá",an-nong,commune,07
01615,"Lộc Thuận","Xã Lộc Thuận, Tỉnh Vĩnh Long",loc-thuan,commune,24
01616,"Nghĩa Sơn","Xã Nghĩa Sơn, Tỉnh Ninh Bình",nghia-son,commune,13
01617,"Bình Tân","Xã Bình Tân, Tỉnh Đồng Nai",binh-tan,commune,22
01618,"Đông Hiếu","Xã Đông Hiếu, Tỉnh Nghệ An",ong-hieu,commune,11
01619,"Lạc Phượng","Xã Lạc Phượng, Thành phố Hải Phòng",lac-phuong,commune,05
01620,"Phú Tân","Phường Phú Tân, Tỉnh Vĩnh Long",phu-tan,ward,24
01621,"Ea Wy","Xã Ea Wy, Tỉnh Đắk Lắk",ea-wy,commune,27
01622,"Tam Sơn","Phường Tam Sơn, Tỉnh Bắc Ninh",tam-son,ward,10
01623,"Quý Lộc","Xã Quý Lộc, Tỉnh Thanh Hoá",quy-loc,commune,07
01624,"Mỹ Quý","Xã Mỹ Quý, Tỉnh Tây Ninh",my-quy,commune,15
01625,"Hoành Bồ","Phường Hoành Bồ, Tỉnh Quảng Ninh",hoanh-bo,ward,08
01626,"Đông Cứu","Xã Đông Cứu, Tỉnh Bắc Ninh",ong-cuu,commune,10
01627,"Phù Mỹ","Xã Phù Mỹ, Tỉnh Gia Lai",phu-my,commune,28
01628,"Gia Hanh","Xã Gia Hanh, Tỉnh Hà Tĩnh",gia-hanh,commune,17
01629,"Ba Sao","Xã Ba Sao, Tỉnh Đồng Tháp",ba-sao,commune,16
01630,"Gia Phú","Xã Gia Phú, Tỉnh Lào Cai",gia-phu,commune,09
01631,"Thạnh Phú","Xã Thạnh Phú, Tỉnh Đồng Tháp",thanh-phu,commune,16
01632,"Châu Hòa","Xã Châu Hòa, Tỉnh Vĩnh Long",chau-hoa,commune,24
01633,"Hiếu Phụng","Xã Hiếu Phụng, Tỉnh Vĩnh Long",hieu-phung,commune,24
01634,"Định Hòa","Xã Định Hòa, Tỉnh Thanh Hoá",inh-hoa,commune,07
01635,"Định Tân","Xã Định Tân, Tỉnh Thanh Hoá",inh-tan,commune,07
01636,"Yên Thắng","Phường Yên Thắng, Tỉnh Ninh Bình",yen-thang,ward,13
01637,"Chi Lăng","Phường Chi Lăng, Tỉnh An Giang",chi-lang,ward,18
01638,"Tiến Thành","Phường Tiến Thành, Tỉnh Lâm Đồng",tien-thanh,ward,29
01639,"Nam Đồng","Xã Nam Đồng, Tỉnh Ninh Bình",nam-ong,commune,13
01640,"An Qui","Xã An Qui, Tỉnh Vĩnh Long",an-qui,commune,24
01641,"Văn Kiều","Xã Văn Kiều, Tỉnh Nghệ An",van-kieu,commune,11
01642,"Duy Tân","Phường Duy Tân, Tỉnh Ninh Bình",duy-tan,ward,13
01643,"Thành Công","Xã Thành Công, Tỉnh Thái Nguyên",thanh-cong,commune,19
01644,"Phú Lộc","Xã Phú Lộc, Thành phố Huế",phu-loc,commune,04
01645,"Sơn Thuỷ","Xã Sơn Thuỷ, Tỉnh Tuyên Quang",son-thuy,commune,34
01646,"Châu Đức","Xã Châu Đức, Thành phố Hồ Chí Minh",chau-uc,commune,30
01647,"Phúc Lộc","Xã Phúc Lộc, Tỉnh Nghệ An",phuc-loc,commune,11
01648,"Hùng Hòa","Xã Hùng Hòa, Tỉnh Vĩnh Long",hung-hoa,commune,24
01649,"Hồng Phong","Xã Hồng Phong, Tỉnh Ninh Bình",hong-phong,commune,13
01650,"Đan Hải","Xã Đan Hải, Tỉnh Hà Tĩnh",an-hai,commune,17
01651,"Chi Lăng","Xã Chi Lăng, Tỉnh Lạng Sơn",chi-lang,commune,20
01652,"Vĩnh Hòa","Xã Vĩnh Hòa, Thành phố Hải Phòng",vinh-hoa,commune,05
01653,"Tiên Phước","Xã Tiên Phước, Thành phố Đà Nẵng",tien-phuoc,commune,12
01654,"Phước Vĩnh Tây","Xã Phước Vĩnh Tây, Tỉnh Tây Ninh",phuoc-vinh-tay,commune,15
01655,"Nguyên Giáp","Xã Nguyên Giáp, Thành phố Hải Phòng",nguyen-giap,commune,05
01656,"Đắk Sắk","Xã Đắk Sắk, Tỉnh Lâm Đồng",ak-sak,commune,29
01657,"Kiến Hưng","Xã Kiến Hưng, Thành phố Hải Phòng",kien-hung,commune,05
01658,"Phong Dinh","Phường Phong Dinh, Thành phố Huế",phong-dinh,ward,04
01659,"Chí Đám","Xã Chí Đám, Tỉnh Phú Thọ",chi-am,commune,06
01660,"Giao Hưng","Xã Giao Hưng, Tỉnh Ninh Bình",giao-hung,commune,13
01661,"A Sào","Xã A Sào, Tỉnh Hưng Yên",a-sao,commune,02
01662,"Bắc Tân Uyên","Xã Bắc Tân Uyên, Thành phố Hồ Chí Minh",bac-tan-uyen,commune,30
01663,"Phú Thọ","Phường Phú Thọ, Tỉnh Phú Thọ",phu-tho,ward,06
01664,"Ka Đô","Xã Ka Đô, Tỉnh Lâm Đồng",ka-o,commune,29
01665,"Kim Bảng","Xã Kim Bảng, Tỉnh Nghệ An",kim-bang,commune,11
01666,"Lịch Hội Thượng","Xã Lịch Hội Thượng, Thành phố Cần Thơ",lich-hoi-thuong,commune,32
01667,"Thắng Lợi","Xã Thắng Lợi, Tỉnh Thanh Hoá",thang-loi,commune,07
01668,"Nhân Cơ","Xã Nhân Cơ, Tỉnh Lâm Đồng",nhan-co,commune,29
01669,"Hoàng Cương","Xã Hoàng Cương, Tỉnh Phú Thọ",hoang-cuong,commune,06
01670,"Phong Điền","Phường Phong Điền, Thành phố Huế",phong-ien,ward,04
01671,"Thọ Lập","Xã Thọ Lập, Tỉnh Thanh Hoá",tho-lap,commune,07
01672,"Nam An Phụ","Xã Nam An Phụ, Thành phố Hải Phòng",nam-an-phu,commune,05
01673,"Sơn Thành","Xã Sơn Thành, Tỉnh Đắk Lắk",son-thanh,commune,27
01674,"Nghĩa Phương","Xã Nghĩa Phương, Tỉnh Bắc Ninh",nghia-phuong,commune,10
01675,"Vĩnh Hải","Xã Vĩnh Hải, Thành phố Cần Thơ",vinh-hai,commune,32
01676,"Nghĩa Thành","Xã Nghĩa Thành, Thành phố Hồ Chí Minh",nghia-thanh,commune,30
01677,"Tân Chi","Xã Tân Chi, Tỉnh Bắc Ninh",tan-chi,commune,10
01678,"Hà Nam","Xã Hà Nam, Thành phố Hải Phòng",ha-nam,commune,05
01679,"Chiềng Mung","Xã Chiềng Mung, Tỉnh Sơn La",chieng-mung,commune,31
01680,"Thọ Phong","Xã Thọ Phong, Tỉnh Quảng Ngãi",tho-phong,commune,23
01681,"Đồng Lộc","Xã Đồng Lộc, Tỉnh Hà Tĩnh",ong-loc,commune,17
01682,"Tân Thành","Xã Tân Thành, Tỉnh Tây Ninh",tan-thanh,commune,15
01683,"Ngọc Liên","Xã Ngọc Liên, Tỉnh Thanh Hoá",ngoc-lien,commune,07
01684,"Liêm Tuyền","Phường Liêm Tuyền, Tỉnh Ninh Bình",liem-tuyen,ward,13
01685,"Quảng Yên","Xã Quảng Yên, Tỉnh Thanh Hoá",quang-yen,commune,07
01686,"Mỹ Thiện","Xã Mỹ Thiện, Tỉnh Đồng Tháp",my-thien,commune,16
01687,"Liêm Hà","Xã Liêm Hà, Tỉnh Ninh Bình",liem-ha,commune,13
01688,"Yên Xuân","Xã Yên Xuân, Tỉnh Nghệ An",yen-xuan,commune,11
01689,"Đất Mới","Xã Đất Mới, Tỉnh Cà Mau",at-moi,commune,33
01690,"Thanh Thuỷ","Xã Thanh Thuỷ, Tỉnh Phú Thọ",thanh-thuy,commune,06
01691,"Nguyễn Uý","Phường Nguyễn Uý, Tỉnh Ninh Bình",nguyen-uy,ward,13
01692,"Hưng Khánh Trung","Xã Hưng Khánh Trung, Tỉnh Vĩnh Long",hung-khanh-trung,commune,24
01693,"Vu Gia","Xã Vu Gia, Thành phố Đà Nẵng",vu-gia,commune,12
01694,"Nam Ba Đồn","Xã Nam Ba Đồn, Tỉnh Quảng Trị",nam-ba-on,commune,03
01695,"Khe Sanh","Xã Khe Sanh, Tỉnh Quảng Trị",khe-sanh,commune,03
01696,"Long Hà","Xã Long Hà, Tỉnh Đồng Nai",long-ha,commune,22
01697,"Xuân Lộc","Xã Xuân Lộc, Tỉnh Đắk Lắk",xuan-loc,commune,27
01698,"Tân Đông","Xã Tân Đông, Tỉnh Tây Ninh",tan-ong,commune,15
01699,"Phú Thuận","Xã Phú Thuận, Thành phố Đà Nẵng",phu-thuan,commune,12
01700,"Nhị Quý","Phường Nhị Quý, Tỉnh Đồng Tháp",nhi-quy,ward,16
01701,"Hoằng Sơn","Xã Hoằng Sơn, Tỉnh Thanh Hoá",hoang-son,commune,07
01702,"Tân An","Xã Tân An, Thành phố Hải Phòng",tan-an,commune,05
01703,"Cư Pui","Xã Cư Pui, Tỉnh Đắk Lắk",cu-pui,commune,27
01704,"An Nghĩa","Xã An Nghĩa, Tỉnh Phú Thọ",an-nghia,commune,06
01705,"Vĩnh Linh","Xã Vĩnh Linh, Tỉnh Quảng Trị",vinh-linh,commune,03
01706,"Bố Hạ","Xã Bố Hạ, Tỉnh Bắc Ninh",bo-ha,commune,10
01707,"Lạc Sơn","Xã Lạc Sơn, Tỉnh Phú Thọ",lac-son,commune,06
01708,"Hiền Quan","Xã Hiền Quan, Tỉnh Phú Thọ",hien-quan,commune,06
01709,"An Phú Tân","Xã An Phú Tân, Tỉnh Vĩnh Long",an-phu-tan,commune,24
01710,"Tây Đô","Xã Tây Đô, Tỉnh Thanh Hoá",tay-o,commune,07
01711,"Tân Ninh","Xã Tân Ninh, Tỉnh Thanh Hoá",tan-ninh,commune,07
01712,"Tiên Lữ","Xã Tiên Lữ, Tỉnh Hưng Yên",tien-lu,commune,02
01713,"Xuân Sơn","Xã Xuân Sơn, Thành phố Hồ Chí Minh",xuan-son,commune,30
01714,"Phong Cốc","Phường Phong Cốc, Tỉnh Quảng Ninh",phong-coc,ward,08
01715,"Dương Kinh","Phường Dương Kinh, Thành phố Hải Phòng",duong-kinh,ward,05
01716,"Bình Dương","Xã Bình Dương, Tỉnh Gia Lai",binh-duong,commune,28
01717,"Hải Hưng","Xã Hải Hưng, Thành phố Hải Phòng",hai-hung,commune,05
01718,"Trung Ngãi","Xã Trung Ngãi, Tỉnh Vĩnh Long",trung-ngai,commune,24
01719,"Phú Lương","Xã Phú Lương, Tỉnh Tuyên Quang",phu-luong,commune,34
01720,"Phước Long","Xã Phước Long, Tỉnh Vĩnh Long",phuoc-long,commune,24
01721,"Hồ Thị Kỷ","Xã Hồ Thị Kỷ, Tỉnh Cà Mau",ho-thi-ky,commune,33
01722,"Than Uyên","Xã Than Uyên, Tỉnh Lai Châu",than-uyen,commune,26
01723,"Thuận Nam","Xã Thuận Nam, Tỉnh Khánh Hòa",thuan-nam,commune,14
01724,"Bát Xát","Xã Bát Xát, Tỉnh Lào Cai",bat-xat,commune,09
01725,"Bắc Thanh Miện","Xã Bắc Thanh Miện, Thành phố Hải Phòng",bac-thanh-mien,commune,05
01726,"Xuân Quang","Xã Xuân Quang, Tỉnh Lào Cai",xuan-quang,commune,09
01727,"Tuệ Tĩnh","Xã Tuệ Tĩnh, Thành phố Hải Phòng",tue-tinh,commune,05
01728,"Phù Mỹ Nam","Xã Phù Mỹ Nam, Tỉnh Gia Lai",phu-my-nam,commune,28
01729,"Thư Trì","Xã Thư Trì, Tỉnh Hưng Yên",thu-tri,commune,02
01730,"Khánh An","Xã Khánh An, Tỉnh Cà Mau",khanh-an,commune,33
01731,"Triệu Bình","Xã Triệu Bình, Tỉnh Quảng Trị",trieu-binh,commune,03
01732,"Đông Thành","Xã Đông Thành, Tỉnh Tây Ninh",ong-thanh,commune,15
01733,"Cửa Việt","Xã Cửa Việt, Tỉnh Quảng Trị",cua-viet,commune,03
01734,"Đông Thái Ninh","Xã Đông Thái Ninh, Tỉnh Hưng Yên",ong-thai-ninh,commune,02
01735,"Cần Giờ","Xã Cần Giờ, Thành phố Hồ Chí Minh",can-gio,commune,30
01736,"Vũ Quý","Xã Vũ Quý, Tỉnh Hưng Yên",vu-quy,commune,02
01737,"Tân Hưng","Xã Tân Hưng, Tỉnh Hưng Yên",tan-hung,commune,02
01738,"Chiềng Sinh","Phường Chiềng Sinh, Tỉnh Sơn La",chieng-sinh,ward,31
01739,"Nhơn Ninh","Xã Nhơn Ninh, Tỉnh Tây Ninh",nhon-ninh,commune,15
01740,"Bom Bo","Xã Bom Bo, Tỉnh Đồng Nai",bom-bo,commune,22
01741,"Hồ Vương","Xã Hồ Vương, Tỉnh Thanh Hoá",ho-vuong,commune,07
01742,"Tiên Sơn","Phường Tiên Sơn, Tỉnh Ninh Bình",tien-son,ward,13
01743,"Trần Nhân Tông","Phường Trần Nhân Tông, Thành phố Hải Phòng",tran-nhan-tong,ward,05
01744,"Vĩnh Trinh","Xã Vĩnh Trinh, Thành phố Cần Thơ",vinh-trinh,commune,32
01745,"Đại Từ","Xã Đại Từ, Tỉnh Thái Nguyên",ai-tu,commune,19
01746,"Thành Vinh","Xã Thành Vinh, Tỉnh Thanh Hoá",thanh-vinh,commune,07
01747,"Yên Trị","Xã Yên Trị, Tỉnh Phú Thọ",yen-tri,commune,06
01748,"Phù Lãng","Xã Phù Lãng, Tỉnh Bắc Ninh",phu-lang,commune,10
01749,"Trung Chính","Xã Trung Chính, Tỉnh Bắc Ninh",trung-chinh,commune,10
01750,"Phú Ninh","Xã Phú Ninh, Thành phố Đà Nẵng",phu-ninh,commune,12
01751,"Cảnh Thụy","Phường Cảnh Thụy, Tỉnh Bắc Ninh",canh-thuy,ward,10
01752,"Hải An","Xã Hải An, Tỉnh Ninh Bình",hai-an,commune,13
01753,"Xuyên Mộc","Xã Xuyên Mộc, Thành phố Hồ Chí Minh",xuyen-moc,commune,30
01754,"Thái Hòa","Phường Thái Hòa, Tỉnh Nghệ An",thai-hoa,ward,11
01755,"Đồng Xuân","Xã Đồng Xuân, Tỉnh Đắk Lắk",ong-xuan,commune,27
01756,"Trung Tâm","Phường Trung Tâm, Tỉnh Lào Cai",trung-tam,ward,09
01757,"Hùng Thắng","Xã Hùng Thắng, Thành phố Hải Phòng",hung-thang,commune,05
01758,"Quang Thiện","Xã Quang Thiện, Tỉnh Ninh Bình",quang-thien,commune,13
01759,"Tân Trụ","Xã Tân Trụ, Tỉnh Tây Ninh",tan-tru,commune,15
01760,"Tam Điệp","Phường Tam Điệp, Tỉnh Ninh Bình",tam-iep,ward,13
01761,"Trường Xuân","Xã Trường Xuân, Tỉnh Lâm Đồng",truong-xuan,commune,29
01762,"Hòa Thắng","Phường Hòa Thắng, Tỉnh Khánh Hòa",hoa-thang,ward,14
01763,"Ayun Pa","Phường Ayun Pa, Tỉnh Gia Lai",ayun-pa,ward,28
01764,"Liên Sơn Lắk","Xã Liên Sơn Lắk, Tỉnh Đắk Lắk",lien-son-lak,commune,27
01765,"Nhân Thắng","Xã Nhân Thắng, Tỉnh Bắc Ninh",nhan-thang,commune,10
01766,"Vĩnh Định","Xã Vĩnh Định, Tỉnh Quảng Trị",vinh-inh,commune,03
01767,"Mỹ Hòa Hưng","Xã Mỹ Hòa Hưng, Tỉnh An Giang",my-hoa-hung,commune,18
01768,"Đồng Việt","Xã Đồng Việt, Tỉnh Bắc Ninh",ong-viet,commune,10
01769,"Hòa Vang","Xã Hòa Vang, Thành phố Đà Nẵng",hoa-vang,commune,12
01770,"Giao Bình","Xã Giao Bình, Tỉnh Ninh Bình",giao-binh,commune,13
01771,"Trần Liễu","Phường Trần Liễu, Thành phố Hải Phòng",tran-lieu,ward,05
01772,"Vụ Bản","Xã Vụ Bản, Tỉnh Ninh Bình",vu-ban,commune,13
01773,"Bách Quang","Phường Bách Quang, Tỉnh Thái Nguyên",bach-quang,ward,19
01774,"Cam Hồng","Xã Cam Hồng, Tỉnh Quảng Trị",cam-hong,commune,03
01775,"Xuân Hòa","Xã Xuân Hòa, Tỉnh Thanh Hoá",xuan-hoa,commune,07
01776,"Ba Vì","Xã Ba Vì, Thành phố Hà Nội",ba-vi,commune,01
01777,"Hòa Trí","Xã Hòa Trí, Tỉnh Khánh Hòa",hoa-tri,commune,14
01778,"Nam Cửa Việt","Xã Nam Cửa Việt, Tỉnh Quảng Trị",nam-cua-viet,commune,03
01779,"Lộc Hưng","Xã Lộc Hưng, Tỉnh Đồng Nai",loc-hung,commune,22
01780,"Sơn Mỹ","Xã Sơn Mỹ, Tỉnh Lâm Đồng",son-my,commune,29
01781,"Quảng Ninh","Xã Quảng Ninh, Tỉnh Thanh Hoá",quang-ninh,commune,07
01782,"Văn Phú","Phường Văn Phú, Tỉnh Lào Cai",van-phu,ward,09
01783,"Thanh Tùng","Xã Thanh Tùng, Tỉnh Cà Mau",thanh-tung,commune,33
01784,"Xuân Đường","Xã Xuân Đường, Tỉnh Đồng Nai",xuan-uong,commune,22
01785,"Yên Minh","Xã Yên Minh, Tỉnh Tuyên Quang",yen-minh,commune,34
01786,"Hưng Thuận","Xã Hưng Thuận, Tỉnh Tây Ninh",hung-thuan,commune,15
01787,"Nga Thắng","Xã Nga Thắng, Tỉnh Thanh Hoá",nga-thang,commune,07
01788,"Xuân Tín","Xã Xuân Tín, Tỉnh Thanh Hoá",xuan-tin,commune,07
01789,"Mỹ Thạnh","Xã Mỹ Thạnh, Tỉnh Tây Ninh",my-thanh,commune,15
01790,"Hòa Mỹ","Xã Hòa Mỹ, Tỉnh Đắk Lắk",hoa-my,commune,27
01791,"Lương Sơn","Xã Lương Sơn, Tỉnh Nghệ An",luong-son,commune,11
01792,"Khánh Trung","Xã Khánh Trung, Tỉnh Ninh Bình",khanh-trung,commune,13
01793,"An Nhơn Đông","Phường An Nhơn Đông, Tỉnh Gia Lai",an-nhon-ong,ward,28
01794,"Tam Nông","Xã Tam Nông, Tỉnh Phú Thọ",tam-nong,commune,06
01795,"Triệu Lộc","Xã Triệu Lộc, Tỉnh Thanh Hoá",trieu-loc,commune,07
01796,"Tam Đồng","Xã Tam Đồng, Tỉnh Nghệ An",tam-ong,commune,11
01797,"Vĩnh Thịnh","Xã Vĩnh Thịnh, Thành phố Hải Phòng",vinh-thinh,commune,05
01798,"Long Bình","Phường Long Bình, Thành phố Cần Thơ",long-binh,ward,32
01799,"Tân Long Hội","Xã Tân Long Hội, Tỉnh Vĩnh Long",tan-long-hoi,commune,24
01800,"Tân Thanh","Xã Tân Thanh, Tỉnh Ninh Bình",tan-thanh,commune,13
01801,"Lộc Quang","Xã Lộc Quang, Tỉnh Đồng Nai",loc-quang,commune,22
01802,"Quới Thiện","Xã Quới Thiện, Tỉnh Vĩnh Long",quoi-thien,commune,24
01803,"Yên Trung","Xã Yên Trung, Tỉnh Nghệ An",yen-trung,commune,11
01804,"Như Thanh","Xã Như Thanh, Tỉnh Thanh Hoá",nhu-thanh,commune,07
01805,"Đào Duy Tư","Phường Đào Duy Tư, Tỉnh Thanh Hoá",ao-duy-tu,ward,07
01806,"Phú Mỹ","Xã Phú Mỹ, Tỉnh Cà Mau",phu-my,commune,33
01807,"Việt An","Xã Việt An, Thành phố Đà Nẵng",viet-an,commune,12
01808,"Kiến Minh","Xã Kiến Minh, Thành phố Hải Phòng",kien-minh,commune,05
01809,"Sông Mã","Xã Sông Mã, Tỉnh Sơn La",song-ma,commune,31
01810,"Tuy An Bắc","Xã Tuy An Bắc, Tỉnh Đắk Lắk",tuy-an-bac,commune,27
01811,"Tiên Hưng","Xã Tiên Hưng, Tỉnh Hưng Yên",tien-hung,commune,02
01812,"Tiên Hoa","Xã Tiên Hoa, Tỉnh Hưng Yên",tien-hoa,commune,02
01813,"Hòa Hội","Xã Hòa Hội, Tỉnh Gia Lai",hoa-hoi,commune,28
01814,"Chấn Hưng","Xã Chấn Hưng, Thành phố Hải Phòng",chan-hung,commune,05
01815,"Mường Động","Xã Mường Động, Tỉnh Phú Thọ",muong-ong,commune,06
01816,"Bình Châu","Xã Bình Châu, Thành phố Hồ Chí Minh",binh-chau,commune,30
01817,"Kim Thanh","Phường Kim Thanh, Tỉnh Ninh Bình",kim-thanh,ward,13
01818,"Cẩm Tú","Xã Cẩm Tú, Tỉnh Thanh Hoá",cam-tu,commune,07
01819,"Con Cuông","Xã Con Cuông, Tỉnh Nghệ An",con-cuong,commune,11
01820,"Đồng Văn","Xã Đồng Văn, Tỉnh Tuyên Quang",ong-van,commune,34
01821,"Hoàng An","Xã Hoàng An, Tỉnh Phú Thọ",hoang-an,commune,06
01822,"Hòa Hiệp","Xã Hòa Hiệp, Thành phố Hồ Chí Minh",hoa-hiep,commune,30
01823,"Đầm Hà","Xã Đầm Hà, Tỉnh Quảng Ninh",am-ha,commune,08
01824,"Lương Hòa","Xã Lương Hòa, Tỉnh Vĩnh Long",luong-hoa,commune,24
01825,"Gia Vân","Xã Gia Vân, Tỉnh Ninh Bình",gia-van,commune,13
01826,"Tân Thạnh","Xã Tân Thạnh, Tỉnh Tây Ninh",tan-thanh,commune,15
01827,"Vân Du","Xã Vân Du, Tỉnh Nghệ An",van-du,commune,11
01828,"Tô Châu","Phường Tô Châu, Tỉnh An Giang",to-chau,ward,18
01829,"Tân Thạnh","Xã Tân Thạnh, Tỉnh Đồng Tháp",tan-thanh,commune,16
01830,"Hưng Phú","Xã Hưng Phú, Tỉnh Hưng Yên",hung-phu,commune,02
01831,"Hải Quang","Xã Hải Quang, Tỉnh Ninh Bình",hai-quang,commune,13
01832,"Hoà Bình","Xã Hoà Bình, Tỉnh Cà Mau",hoa-binh,commune,33
01833,"Xuân Trúc","Xã Xuân Trúc, Tỉnh Hưng Yên",xuan-truc,commune,02
01834,"Tân Phước Hưng","Xã Tân Phước Hưng, Thành phố Cần Thơ",tan-phuoc-hung,commune,32
01835,"Thuận Bắc","Xã Thuận Bắc, Tỉnh Khánh Hòa",thuan-bac,commune,14
01836,"Phong Quảng","Phường Phong Quảng, Thành phố Huế",phong-quang,ward,04
01837,"Tân Thành","Xã Tân Thành, Tỉnh Thái Nguyên",tan-thanh,commune,19
01838,"Thạnh Phú","Xã Thạnh Phú, Thành phố Cần Thơ",thanh-phu,commune,32
01839,"Khánh Thiện","Xã Khánh Thiện, Tỉnh Ninh Bình",khanh-thien,commune,13
01840,"Nghi Dương","Xã Nghi Dương, Thành phố Hải Phòng",nghi-duong,commune,05
01841,"Nghĩa Khánh","Xã Nghĩa Khánh, Tỉnh Nghệ An",nghia-khanh,commune,11
01842,"Ngô Mây","Xã Ngô Mây, Tỉnh Gia Lai",ngo-may,commune,28
01843,"Đại Lãnh","Xã Đại Lãnh, Tỉnh Khánh Hòa",ai-lanh,commune,14
01844,"Lý Sơn","Đặc khu Lý Sơn, Tỉnh Quảng Ngãi",ly-son,commune,23
01845,"Phú Khê","Xã Phú Khê, Tỉnh Phú Thọ",phu-khe,commune,06
01846,"Tân Hải","Xã Tân Hải, Tỉnh Lâm Đồng",tan-hai,commune,29
01847,"Khánh Nhạc","Xã Khánh Nhạc, Tỉnh Ninh Bình",khanh-nhac,commune,13
01848,"Tam Giang","Xã Tam Giang, Tỉnh Bắc Ninh",tam-giang,commune,10
01849,"Mường Lai","Xã Mường Lai, Tỉnh Lào Cai",muong-lai,commune,09
01850,"Hoài Nhơn Tây","Phường Hoài Nhơn Tây, Tỉnh Gia Lai",hoai-nhon-tay,ward,28
01851,"Lương Phú","Xã Lương Phú, Tỉnh Vĩnh Long",luong-phu,commune,24
01852,"Nam Hải Lăng","Xã Nam Hải Lăng, Tỉnh Quảng Trị",nam-hai-lang,commune,03
01853,"An Hưng","Xã An Hưng, Thành phố Hải Phòng",an-hung,commune,05
01854,"Tân Cương","Xã Tân Cương, Tỉnh Thái Nguyên",tan-cuong,commune,19
01855,"Tam Sơn","Xã Tam Sơn, Tỉnh Phú Thọ",tam-son,commune,06
01856,"Mường Thanh","Phường Mường Thanh, Tỉnh Điện Biên",muong-thanh,ward,21
01857,"Bình An","Xã Bình An, Tỉnh Đồng Nai",binh-an,commune,22
01858,"Lê Lợi","Xã Lê Lợi, Tỉnh Hưng Yên",le-loi,commune,02
01859,"Tam Giang","Xã Tam Giang, Tỉnh Đắk Lắk",tam-giang,commune,27
01860,"Nghĩa Hưng","Xã Nghĩa Hưng, Tỉnh Nghệ An",nghia-hung,commune,11
01861,"Xuân Lộc","Xã Xuân Lộc, Tỉnh Hà Tĩnh",xuan-loc,commune,17
01862,"Châu Pha","Xã Châu Pha, Thành phố Hồ Chí Minh",chau-pha,commune,30
01863,"Cầu Khởi","Xã Cầu Khởi, Tỉnh Tây Ninh",cau-khoi,commune,15
01864,"Đoàn Kết","Phường Đoàn Kết, Tỉnh Lai Châu",oan-ket,ward,26
01865,"Hòa Sơn","Xã Hòa Sơn, Tỉnh Đắk Lắk",hoa-son,commune,27
01866,"Bắc Kạn","Phường Bắc Kạn, Tỉnh Thái Nguyên",bac-kan,ward,19
01867,"Mỹ Long","Xã Mỹ Long, Tỉnh Vĩnh Long",my-long,commune,24
01868,"Hòa Thuận","Phường Hòa Thuận, Tỉnh Vĩnh Long",hoa-thuan,ward,24
01869,"Thiệu Tiến","Xã Thiệu Tiến, Tỉnh Thanh Hoá",thieu-tien,commune,07
01870,"Bồng Lai","Phường Bồng Lai, Tỉnh Bắc Ninh",bong-lai,ward,10
01871,"Vàm Cỏ","Xã Vàm Cỏ, Tỉnh Tây Ninh",vam-co,commune,15
01872,"Thanh An","Xã Thanh An, Thành phố Hồ Chí Minh",thanh-an,commune,30
01873,"Trường Long Tây","Xã Trường Long Tây, Thành phố Cần Thơ",truong-long-tay,commune,32
01874,"Cẩm Bình","Xã Cẩm Bình, Tỉnh Hà Tĩnh",cam-binh,commune,17
01875,"Nam Đông Hưng","Xã Nam Đông Hưng, Tỉnh Hưng Yên",nam-ong-hung,commune,02
01876,"Lạc Lương","Xã Lạc Lương, Tỉnh Phú Thọ",lac-luong,commune,06
01877,"Mường Bú","Xã Mường Bú, Tỉnh Sơn La",muong-bu,commune,31
01878,"Kbang","Xã Kbang, Tỉnh Gia Lai",kbang,commune,28
01879,"Bà Nà","Xã Bà Nà, Thành phố Đà Nẵng",ba-na,commune,12
01880,"Bắc Đông Quan","Xã Bắc Đông Quan, Tỉnh Hưng Yên",bac-ong-quan,commune,02
01881,"Tây Tiền Hải","Xã Tây Tiền Hải, Tỉnh Hưng Yên",tay-tien-hai,commune,02
01882,"Cầu Thia","Phường Cầu Thia, Tỉnh Lào Cai",cau-thia,ward,09
01883,"Bảo Thạnh","Xã Bảo Thạnh, Tỉnh Vĩnh Long",bao-thanh,commune,24
01884,"Đăk Rơ Wa","Xã Đăk Rơ Wa, Tỉnh Quảng Ngãi",ak-ro-wa,commune,23
01885,"Long Hòa","Xã Long Hòa, Thành phố Hồ Chí Minh",long-hoa,commune,30
01886,"Phú Sơn - Lâm Hà","Xã Phú Sơn - Lâm Hà, Tỉnh Lâm Đồng",phu-son-lam-ha,commune,29
01887,"Núi Cấm","Xã Núi Cấm, Tỉnh An Giang",nui-cam,commune,18
01888,"Đông Quan","Xã Đông Quan, Tỉnh Hưng Yên",ong-quan,commune,02
01889,"Phú Thành","Xã Phú Thành, Tỉnh Đồng Tháp",phu-thanh,commune,16
01890,"Diên Sanh","Xã Diên Sanh, Tỉnh Quảng Trị",dien-sanh,commune,03
01891,"Hồng Thái","Xã Hồng Thái, Tỉnh Lâm Đồng",hong-thai,commune,29
01892,"Tân Hộ Cơ","Xã Tân Hộ Cơ, Tỉnh Đồng Tháp",tan-ho-co,commune,16
01893,"Nghĩa Lộc","Xã Nghĩa Lộc, Tỉnh Nghệ An",nghia-loc,commune,11
01894,"Đồng Bằng","Xã Đồng Bằng, Tỉnh Hưng Yên",ong-bang,commune,02
01895,"Vân Hồ","Xã Vân Hồ, Tỉnh Sơn La",van-ho,commune,31
01896,"Phúc Hòa","Xã Phúc Hòa, Tỉnh Bắc Ninh",phuc-hoa,commune,10
01897,"Phước Long","Xã Phước Long, Tỉnh Cà Mau",phuoc-long,commune,33
01898,"Đồng Đăng","Xã Đồng Đăng, Tỉnh Lạng Sơn",ong-ang,commune,20
01899,"An Sinh","Phường An Sinh, Tỉnh Quảng Ninh",an-sinh,ward,08
01900,"Nga An","Xã Nga An, Tỉnh Thanh Hoá",nga-an,commune,07
01901,"Kinh Môn","Phường Kinh Môn, Thành phố Hải Phòng",kinh-mon,ward,05
01902,"Ia Ko","Xã Ia Ko, Tỉnh Gia Lai",ia-ko,commune,28
01903,"Hàng Gòn","Phường Hàng Gòn, Tỉnh Đồng Nai",hang-gon,ward,22
01904,"Phạm Sư Mạnh","Phường Phạm Sư Mạnh, Thành phố Hải Phòng",pham-su-manh,ward,05
01905,"Cà Ná","Xã Cà Ná, Tỉnh Khánh Hòa",ca-na,commune,14
01906,"Nam Đồng","Phường Nam Đồng, Thành phố Hải Phòng",nam-ong,ward,05
01907,"Quảng Lập","Xã Quảng Lập, Tỉnh Lâm Đồng",quang-lap,commune,29
01908,"Lĩnh Toại","Xã Lĩnh Toại, Tỉnh Thanh Hoá",linh-toai,commune,07
01909,"Quy Nhơn Tây","Phường Quy Nhơn Tây, Tỉnh Gia Lai",quy-nhon-tay,ward,28
01910,"Tam Quan","Phường Tam Quan, Tỉnh Gia Lai",tam-quan,ward,28
01911,"Tiên Điền","Xã Tiên Điền, Tỉnh Hà Tĩnh",tien-ien,commune,17
01912,"Vĩnh Tường","Xã Vĩnh Tường, Tỉnh Nghệ An",vinh-tuong,commune,11
01913,"Thăng Trường","Xã Thăng Trường, Thành phố Đà Nẵng",thang-truong,commune,12
01914,"Thạnh Bình","Xã Thạnh Bình, Thành phố Đà Nẵng",thanh-binh,commune,12
01915,"Sơn Hạ","Xã Sơn Hạ, Tỉnh Quảng Ngãi",son-ha,commune,23
01916,"Đồng Dương","Xã Đồng Dương, Thành phố Đà Nẵng",ong-duong,commune,12
01917,"Đạo Trù","Xã Đạo Trù, Tỉnh Phú Thọ",ao-tru,commune,06
01918,"Xuân Ái","Xã Xuân Ái, Tỉnh Lào Cai",xuan-ai,commune,09
01919,"Ái Quốc","Phường Ái Quốc, Thành phố Hải Phòng",ai-quoc,ward,05
01920,"Tây Hiếu","Phường Tây Hiếu, Tỉnh Nghệ An",tay-hieu,ward,11
01921,"Thượng Cát","Phường Thượng Cát, Thành phố Hà Nội",thuong-cat,ward,01
