code,name,fullName,slug,type,provinceCode
00013,"Hà Đông","Phường Hà Đông, Thành phố Hà Nội",ha-ong,ward,01
00044,"Tương Mai","Phường Tương Mai, Thành phố Hà Nội",tuong-mai,ward,01
00051,"Bạch Mai","Phường Bạch Mai, Thành phố Hà Nội",bach-mai,ward,01
00063,"Nghĩa Đô","Phường Nghĩa Đô, Thành phố Hà Nội",nghia-o,ward,01
00066,"Hồng Hà","Phường Hồng Hà, Thành phố Hà Nội",hong-ha,ward,01
00072,"Bồ Đề","Phường Bồ Đề, Thành phố Hà Nội",bo-e,ward,01
00073,"Từ Liêm","Phường Từ Liêm, Thành phố Hà Nội",tu-liem,ward,01
00079,"Đông Anh","Xã Đông Anh, Thành phố Hà Nội",ong-anh,commune,01
00080,"Sóc Sơn","Xã Sóc Sơn, Thành phố Hà Nội",soc-son,commune,01
00091,"Phù Đổng","Xã Phù Đổng, Thành phố Hà Nội",phu-ong,commune,01
00096,"Kim Liên","Phường Kim Liên, Thành phố Hà Nội",kim-lien,ward,01
00101,"Thanh Xuân","Phường Thanh Xuân, Thành phố Hà Nội",thanh-xuan,ward,01
00103,"Văn Miếu - Quốc Tử Giám","Phường Văn Miếu - Quốc Tử Giám, Thành phố Hà Nội",van-mieu-quoc-tu-giam,ward,01
00104,"Hoàn Kiếm","Phường Hoàn Kiếm, Thành phố Hà Nội",hoan-kiem,ward,01
00106,"Xuân Phương","Phường Xuân Phương, Thành phố Hà Nội",xuan-phuong,ward,01
00114,"Thư Lâm","Xã Thư Lâm, Thành phố Hà Nội",thu-lam,commune,01
00116,"An Khánh","Xã An Khánh, Thành phố Hà Nội",an-khanh,commune,01
00119,"Tây Hồ","Phường Tây Hồ, Thành phố Hà Nội",tay-ho,ward,01
00120,"Tây Phương","Xã Tây Phương, Thành phố Hà Nội",tay-phuong,commune,01
00124,"Hoàng Mai","Phường Hoàng Mai, Thành phố Hà Nội",hoang-mai,ward,01
00127,"Ô Diên","Xã Ô Diên, Thành phố Hà Nội",o-dien,commune,01
00129,"Giảng Võ","Phường Giảng Võ, Thành phố Hà Nội",giang-vo,ward,01
00130,"Phú Xuyên","Xã Phú Xuyên, Thành phố Hà Nội",phu-xuyen,commune,01
00132,"Phúc Thịnh","Xã Phúc Thịnh, Thành phố Hà Nội",phuc-thinh,commune,01
00136,"Ngọc Hà","Phường Ngọc Hà, Thành phố Hà Nội",ngoc-ha,ward,01
00142,"Đại Thanh","Xã Đại Thanh, Thành phố Hà Nội",ai-thanh,commune,01
00147,"Vĩnh Tuy","Phường Vĩnh Tuy, Thành phố Hà Nội",vinh-tuy,ward,01
00148,"Gia Lâm","Xã Gia Lâm, Thành phố Hà Nội",gia-lam,commune,01
00158,"Chương Mỹ","Phường Chương Mỹ, Thành phố Hà Nội",chuong-my,ward,01
00159,"Hai Bà Trưng","Phường Hai Bà Trưng, Thành phố Hà Nội",hai-ba-trung,ward,01
00165,"Khương Đình","Phường Khương Đình, Thành phố Hà Nội",khuong-inh,ward,01
00169,"Định Công","Phường Định Công, Thành phố Hà Nội",inh-cong,ward,01
00180,"Đa Phúc","Xã Đa Phúc, Thành phố Hà Nội",a-phuc,commune,01
00181,"Đông Ngạc","Phường Đông Ngạc, Thành phố Hà Nội",ong-ngac,ward,01
00183,"Việt Hưng","Phường Việt Hưng, Thành phố Hà Nội",viet-hung,ward,01
00185,"Phương Liệt","Phường Phương Liệt, Thành phố Hà Nội",phuong-liet,ward,01
00187,"Đống Đa","Phường Đống Đa, Thành phố Hà Nội",ong-a,ward,01
00192,"Đại Mỗ","Phường Đại Mỗ, Thành phố Hà Nội",ai-mo,ward,01
00193,"Bình Minh","Xã Bình Minh, Thành phố Hà Nội",binh-minh,commune,01
00214,"Yên Hòa","Phường Yên Hòa, Thành phố Hà Nội",yen-hoa,ward,01
00222,"Thanh Liệt","Phường Thanh Liệt, Thành phố Hà Nội",thanh-liet,ward,01
00228,"Phúc Thọ","Xã Phúc Thọ, Thành phố Hà Nội",phuc-tho,commune,01
00230,"Đại Xuyên","Xã Đại Xuyên, Thành phố Hà Nội",ai-xuyen,commune,01
00231,"Phú Diễn","Phường Phú Diễn, Thành phố Hà Nội",phu-dien,ward,01
00232,"Thiên Lộc","Xã Thiên Lộc, Thành phố Hà Nội",thien-loc,commune,01
00233,"Cầu Giấy","Phường Cầu Giấy, Thành phố Hà Nội",cau-giay,ward,01
00252,"Hát Môn","Xã Hát Môn, Thành phố Hà Nội",hat-mon,commune,01
00267,"Yên Lãng","Xã Yên Lãng, Thành phố Hà Nội",yen-lang,commune,01
00268,"Sơn Tây","Phường Sơn Tây, Thành phố Hà Nội",son-tay,ward,01
00269,"Ô Chợ Dừa","Phường Ô Chợ Dừa, Thành phố Hà Nội",o-cho-dua,ward,01
00273,"Phú Nghĩa","Xã Phú Nghĩa, Thành phố Hà Nội",phu-nghia,commune,01
00274,"Kiến Hưng","Phường Kiến Hưng, Thành phố Hà Nội",kien-hung,ward,01
00275,"Thường Tín","Xã Thường Tín, Thành phố Hà Nội",thuong-tin,commune,01
00277,"Cổ Đô","Xã Cổ Đô, Thành phố Hà Nội",co-o,commune,01
00281,"Nội Bài","Xã Nội Bài, Thành phố Hà Nội",noi-bai,commune,01
00288,"Quang Minh","Xã Quang Minh, Thành phố Hà Nội",quang-minh,commune,01
00289,"Hòa Xá","Xã Hòa Xá, Thành phố Hà Nội",hoa-xa,commune,01
00292,"Hoài Đức","Xã Hoài Đức, Thành phố Hà Nội",hoai-uc,commune,01
00302,"Thuận An","Xã Thuận An, Thành phố Hà Nội",thuan-an,commune,01
00309,"Vĩnh Hưng","Phường Vĩnh Hưng, Thành phố Hà Nội",vinh-hung,ward,01
00310,"Xuân Mai","Xã Xuân Mai, Thành phố Hà Nội",xuan-mai,commune,01
00314,"Phúc Lợi","Phường Phúc Lợi, Thành phố Hà Nội",phuc-loi,ward,01
00324,"Ba Đình","Phường Ba Đình, Thành phố Hà Nội",ba-inh,ward,01
00329,"Vĩnh Thanh","Xã Vĩnh Thanh, Thành phố Hà Nội",vinh-thanh,commune,01
00333,"Tiến Thắng","Xã Tiến Thắng, Thành phố Hà Nội",tien-thang,commune,01
00339,"Ứng Hòa","Xã Ứng Hòa, Thành phố Hà Nội",ung-hoa,commune,01
00344,"Quốc Oai","Xã Quốc Oai, Thành phố Hà Nội",quoc-oai,commune,01
00347,"Sơn Đồng","Xã Sơn Đồng, Thành phố Hà Nội",son-ong,commune,01
00351,"Hồng Sơn","Xã Hồng Sơn, Thành phố Hà Nội",hong-son,commune,01
00353,"Quảng Bị","Xã Quảng Bị, Thành phố Hà Nội",quang-bi,commune,01
00355,"Long Biên","Phường Long Biên, Thành phố Hà Nội",long-bien,ward,01
00358,"Dân Hòa","Xã Dân Hòa, Thành phố Hà Nội",dan-hoa,commune,01
00362,"Mê Linh","Xã Mê Linh, Thành phố Hà Nội",me-linh,commune,01
00371,"Phúc Lộc","Xã Phúc Lộc, Thành phố Hà Nội",phuc-loc,commune,01
00373,"Trung Giã","Xã Trung Giã, Thành phố Hà Nội",trung-gia,commune,01
00379,"Láng","Phường Láng, Thành phố Hà Nội",lang,ward,01
00383,"Kiều Phú","Xã Kiều Phú, Thành phố Hà Nội",kieu-phu,commune,01
00384,"Vân Đình","Xã Vân Đình, Thành phố Hà Nội",van-inh,commune,01
00393,"Phượng Dực","Xã Phượng Dực, Thành phố Hà Nội",phuong-duc,commune,01
00396,"Chương Dương","Xã Chương Dương, Thành phố Hà Nội",chuong-duong,commune,01
00409,"Quảng Oai","Xã Quảng Oai, Thành phố Hà Nội",quang-oai,commune,01
00411,"Dương Hòa","Xã Dương Hòa, Thành phố Hà Nội",duong-hoa,commune,01
00413,"Hồng Vân","Xã Hồng Vân, Thành phố Hà Nội",hong-van,commune,01
00416,"Vật Lại","Xã Vật Lại, Thành phố Hà Nội",vat-lai,commune,01
00431,"Thạch Thất","Xã Thạch Thất, Thành phố Hà Nội",thach-that,commune,01
00449,"Dương Nội","Phường Dương Nội, Thành phố Hà Nội",duong-noi,ward,01
00453,"Hoàng Liệt","Phường Hoàng Liệt, Thành phố Hà Nội",hoang-liet,ward,01
00472,"Thanh Oai","Xã Thanh Oai, Thành phố Hà Nội",thanh-oai,commune,01
00482,"Phúc Sơn","Xã Phúc Sơn, Thành phố Hà Nội",phuc-son,commune,01
00484,"Ứng Thiên","Xã Ứng Thiên, Thành phố Hà Nội",ung-thien,commune,01
00490,"Mỹ Đức","Xã Mỹ Đức, Thành phố Hà Nội",my-uc,commune,01
00506,"Cửa Nam","Phường Cửa Nam, Thành phố Hà Nội",cua-nam,ward,01
00508,"Hương Sơn","Xã Hương Sơn, Thành phố Hà Nội",huong-son,commune,01
00519,"Phú Lương","Phường Phú Lương, Thành phố Hà Nội",phu-luong,ward,01
00538,"Thanh Trì","Xã Thanh Trì, Thành phố Hà Nội",thanh-tri,commune,01
00576,"Hòa Phú","Xã Hòa Phú, Thành phố Hà Nội",hoa-phu,commune,01
00585,"Yên Nghĩa","Phường Yên Nghĩa, Thành phố Hà Nội",yen-nghia,ward,01
00597,"Hưng Đạo","Xã Hưng Đạo, Thành phố Hà Nội",hung-ao,commune,01
00608,"Bát Tràng","Xã Bát Tràng, Thành phố Hà Nội",bat-trang,commune,01
00617,"Xuân Đỉnh","Phường Xuân Đỉnh, Thành phố Hà Nội",xuan-inh,ward,01
00621,"Kim Anh","Xã Kim Anh, Thành phố Hà Nội",kim-anh,commune,01
00635,"Liên Minh","Xã Liên Minh, Thành phố Hà Nội",lien-minh,commune,01
00639,"Đan Phượng","Xã Đan Phượng, Thành phố Hà Nội",an-phuong,commune,01
00641,"Trần Phú","Xã Trần Phú, Thành phố Hà Nội",tran-phu,commune,01
00659,"Tây Mỗ","Phường Tây Mỗ, Thành phố Hà Nội",tay-mo,ward,01
00706,"Thượng Phúc","Xã Thượng Phúc, Thành phố Hà Nội",thuong-phuc,commune,01
00722,"Chuyên Mỹ","Xã Chuyên Mỹ, Thành phố Hà Nội",chuyen-my,commune,01
00756,"Ngọc Hồi","Xã Ngọc Hồi, Thành phố Hà Nội",ngoc-hoi,commune,01
00777,"Phú Cát","Xã Phú Cát, Thành phố Hà Nội",phu-cat,commune,01
00793,"Nam Phù","Xã Nam Phù, Thành phố Hà Nội",nam-phu,commune,01
00824,"Tùng Thiện","Phường Tùng Thiện, Thành phố Hà Nội",tung-thien,ward,01
00862,"Yên Sở","Phường Yên Sở, Thành phố Hà Nội",yen-so,ward,01
00908,"Bất Bạt","Xã Bất Bạt, Thành phố Hà Nội",bat-bat,commune,01
00919,"Đoài Phương","Xã Đoài Phương, Thành phố Hà Nội",oai-phuong,commune,01
00934,"Tây Tựu","Phường Tây Tựu, Thành phố Hà Nội",tay-tuu,ward,01
00941,"Phú Thượng","Phường Phú Thượng, Thành phố Hà Nội",phu-thuong,ward,01
00951,"Tam Hưng","Xã Tam Hưng, Thành phố Hà Nội",tam-hung,commune,01
00970,"Hạ Bằng","Xã Hạ Bằng, Thành phố Hà Nội",ha-bang,commune,01
01175,"Suối Hai","Xã Suối Hai, Thành phố Hà Nội",suoi-hai,commune,01
01568,"Yên Xuân","Xã Yên Xuân, Thành phố Hà Nội",yen-xuan,commune,01
01776,"Ba Vì","Xã Ba Vì, Thành phố Hà Nội",ba-vi,commune,01
01921,"Thượng Cát","Phường Thượng Cát, Thành phố Hà Nội",thuong-cat,ward,01
02175,"Yên Bài","Xã Yên Bài, Thành phố Hà Nội",yen-bai,commune,01
02216,"Hòa Lạc","Xã Hòa Lạc, Thành phố Hà Nội",hoa-lac,commune,01
02221,"Lĩnh Nam","Phường Lĩnh Nam, Thành phố Hà Nội",linh-nam,ward,01
03147,"Minh Châu","Xã Minh Châu, Thành phố Hà Nội",minh-chau,commune,01