code,name,fullName,slug,type,provinceCode
00363,"Phú Túc","Xã Phú Túc, Tỉnh Vĩnh Long",phu-tuc,commune,24
00478,"Long Hồ","Xã Long Hồ, Tỉnh Vĩnh Long",long-ho,commune,24
00496,"An Hội","Phường An Hội, Tỉnh Vĩnh Long",an-hoi,ward,24
00518,"Ba Tri","Xã Ba Tri, Tỉnh Vĩnh Long",ba-tri,commune,24
00539,"An Bình","Xã An Bình, Tỉnh Vĩnh Long",an-binh,commune,24
00553,"Tân Quới","Xã Tân Quới, Tỉnh Vĩnh Long",tan-quoi,commune,24
00554,"Phước Hậu","Phường Phước Hậu, Tỉnh Vĩnh Long",phuoc-hau,ward,24
00561,"Song Phú","Xã Song Phú, Tỉnh Vĩnh Long",song-phu,commune,24
00564,"Châu Thành","Xã Châu Thành, Tỉnh Vĩnh Long",chau-thanh,commune,24
00579,"Mỏ Cày","Xã Mỏ Cày, Tỉnh Vĩnh Long",mo-cay,commune,24
00584,"Phú Quới","Xã Phú Quới, Tỉnh Vĩnh Long",phu-quoi,commune,24
00589,"Long Châu","Phường Long Châu, Tỉnh Vĩnh Long",long-chau,ward,24
00613,"Ngãi Tứ","Xã Ngãi Tứ, Tỉnh Vĩnh Long",ngai-tu,commune,24
00655,"Phú Khương","Phường Phú Khương, Tỉnh Vĩnh Long",phu-khuong,ward,24
00661,"Tân Thành Bình","Xã Tân Thành Bình, Tỉnh Vĩnh Long",tan-thanh-binh,commune,24
00695,"Trà Côn","Xã Trà Côn, Tỉnh Vĩnh Long",tra-con,commune,24
00697,"Tân Thủy","Xã Tân Thủy, Tỉnh Vĩnh Long",tan-thuy,commune,24
00703,"An Trường","Xã An Trường, Tỉnh Vĩnh Long",an-truong,commune,24
00707,"Trà Vinh","Phường Trà Vinh, Tỉnh Vĩnh Long",tra-vinh,ward,24
00744,"Chợ Lách","Xã Chợ Lách, Tỉnh Vĩnh Long",cho-lach,commune,24
00787,"Vĩnh Thành","Xã Vĩnh Thành, Tỉnh Vĩnh Long",vinh-thanh,commune,24
00801,"Song Lộc","Xã Song Lộc, Tỉnh Vĩnh Long",song-loc,commune,24
00808,"Vĩnh Xuân","Xã Vĩnh Xuân, Tỉnh Vĩnh Long",vinh-xuan,commune,24
00814,"Thạnh Phú","Xã Thạnh Phú, Tỉnh Vĩnh Long",thanh-phu,commune,24
00830,"Đông Thành","Phường Đông Thành, Tỉnh Vĩnh Long",ong-thanh,ward,24
00834,"Càng Long","Xã Càng Long, Tỉnh Vĩnh Long",cang-long,commune,24
00835,"Phong Thạnh","Xã Phong Thạnh, Tỉnh Vĩnh Long",phong-thanh,commune,24
00849,"Tân Hòa","Xã Tân Hòa, Tỉnh Vĩnh Long",tan-hoa,commune,24
00888,"Tam Ngãi","Xã Tam Ngãi, Tỉnh Vĩnh Long",tam-ngai,commune,24
00890,"Hưng Mỹ","Xã Hưng Mỹ, Tỉnh Vĩnh Long",hung-my,commune,24
00902,"Giao Long","Xã Giao Long, Tỉnh Vĩnh Long",giao-long,commune,24
00914,"Tập Sơn","Xã Tập Sơn, Tỉnh Vĩnh Long",tap-son,commune,24
00924,"Hoà Bình","Xã Hoà Bình, Tỉnh Vĩnh Long",hoa-binh,commune,24
00947,"Bình Phú","Xã Bình Phú, Tỉnh Vĩnh Long",binh-phu,commune,24
00962,"Tân Lược","Xã Tân Lược, Tỉnh Vĩnh Long",tan-luoc,commune,24
00963,"Nhuận Phú Tân","Xã Nhuận Phú Tân, Tỉnh Vĩnh Long",nhuan-phu-tan,commune,24
00981,"Cái Nhum","Xã Cái Nhum, Tỉnh Vĩnh Long",cai-nhum,commune,24
00983,"Phú Phụng","Xã Phú Phụng, Tỉnh Vĩnh Long",phu-phung,commune,24
00986,"Hương Mỹ","Xã Hương Mỹ, Tỉnh Vĩnh Long",huong-my,commune,24
00995,"Nhị Trường","Xã Nhị Trường, Tỉnh Vĩnh Long",nhi-truong,commune,24
01012,"Trà Ôn","Xã Trà Ôn, Tỉnh Vĩnh Long",tra-on,commune,24
01022,"An Định","Xã An Định, Tỉnh Vĩnh Long",an-inh,commune,24
01027,"Giồng Trôm","Xã Giồng Trôm, Tỉnh Vĩnh Long",giong-trom,commune,24
01030,"Hưng Nhượng","Xã Hưng Nhượng, Tỉnh Vĩnh Long",hung-nhuong,commune,24
01046,"Đại Điền","Xã Đại Điền, Tỉnh Vĩnh Long",ai-ien,commune,24
01057,"Nguyệt Hóa","Phường Nguyệt Hóa, Tỉnh Vĩnh Long",nguyet-hoa,ward,24
01082,"Cái Ngang","Xã Cái Ngang, Tỉnh Vĩnh Long",cai-ngang,commune,24
01087,"Phước Mỹ Trung","Xã Phước Mỹ Trung, Tỉnh Vĩnh Long",phuoc-my-trung,commune,24
01093,"Tân Xuân","Xã Tân Xuân, Tỉnh Vĩnh Long",tan-xuan,commune,24
01121,"Cái Vồn","Phường Cái Vồn, Tỉnh Vĩnh Long",cai-von,ward,24
01126,"Bến Tre","Phường Bến Tre, Tỉnh Vĩnh Long",ben-tre,ward,24
01147,"Trung Thành","Xã Trung Thành, Tỉnh Vĩnh Long",trung-thanh,commune,24
01157,"Cầu Kè","Xã Cầu Kè, Tỉnh Vĩnh Long",cau-ke,commune,24
01163,"Đồng Khởi","Xã Đồng Khởi, Tỉnh Vĩnh Long",ong-khoi,commune,24
01165,"Tân Phú","Xã Tân Phú, Tỉnh Vĩnh Long",tan-phu,commune,24
01177,"Thanh Đức","Phường Thanh Đức, Tỉnh Vĩnh Long",thanh-uc,ward,24
01181,"Thành Thới","Xã Thành Thới, Tỉnh Vĩnh Long",thanh-thoi,commune,24
01187,"Nhơn Phú","Xã Nhơn Phú, Tỉnh Vĩnh Long",nhon-phu,commune,24
01195,"Nhị Long","Xã Nhị Long, Tỉnh Vĩnh Long",nhi-long,commune,24
01206,"Trung Hiệp","Xã Trung Hiệp, Tỉnh Vĩnh Long",trung-hiep,commune,24
01212,"Hiếu Thành","Xã Hiếu Thành, Tỉnh Vĩnh Long",hieu-thanh,commune,24
01217,"Bình Minh","Phường Bình Minh, Tỉnh Vĩnh Long",binh-minh,ward,24
01218,"Sơn Đông","Phường Sơn Đông, Tỉnh Vĩnh Long",son-ong,ward,24
01225,"Tiểu Cần","Xã Tiểu Cần, Tỉnh Vĩnh Long",tieu-can,commune,24
01243,"Bình Đại","Xã Bình Đại, Tỉnh Vĩnh Long",binh-ai,commune,24
01253,"Long Đức","Phường Long Đức, Tỉnh Vĩnh Long",long-uc,ward,24
01302,"Tân An","Xã Tân An, Tỉnh Vĩnh Long",tan-an,commune,24
01333,"Tam Bình","Xã Tam Bình, Tỉnh Vĩnh Long",tam-binh,commune,24
01343,"Long Hiệp","Xã Long Hiệp, Tỉnh Vĩnh Long",long-hiep,commune,24
01352,"Ngũ Lạc","Xã Ngũ Lạc, Tỉnh Vĩnh Long",ngu-lac,commune,24
01366,"Tân Hạnh","Phường Tân Hạnh, Tỉnh Vĩnh Long",tan-hanh,ward,24
01368,"Đôn Châu","Xã Đôn Châu, Tỉnh Vĩnh Long",on-chau,commune,24
01379,"Tập Ngãi","Xã Tập Ngãi, Tỉnh Vĩnh Long",tap-ngai,commune,24
01382,"Tiên Thủy","Xã Tiên Thủy, Tỉnh Vĩnh Long",tien-thuy,commune,24
01406,"Hiệp Mỹ","Xã Hiệp Mỹ, Tỉnh Vĩnh Long",hiep-my,commune,24
01422,"Tân Ngãi","Phường Tân Ngãi, Tỉnh Vĩnh Long",tan-ngai,ward,24
01427,"An Hiệp","Xã An Hiệp, Tỉnh Vĩnh Long",an-hiep,commune,24
01439,"Hòa Hiệp","Xã Hòa Hiệp, Tỉnh Vĩnh Long",hoa-hiep,commune,24
01466,"Hàm Giang","Xã Hàm Giang, Tỉnh Vĩnh Long",ham-giang,commune,24
01470,"Tân Hào","Xã Tân Hào, Tỉnh Vĩnh Long",tan-hao,commune,24
01498,"Vinh Kim","Xã Vinh Kim, Tỉnh Vĩnh Long",vinh-kim,commune,24
01511,"Trà Cú","Xã Trà Cú, Tỉnh Vĩnh Long",tra-cu,commune,24
01513,"Quới Điền","Xã Quới Điền, Tỉnh Vĩnh Long",quoi-ien,commune,24
01544,"Lưu Nghiệp Anh","Xã Lưu Nghiệp Anh, Tỉnh Vĩnh Long",luu-nghiep-anh,commune,24
01558,"Thạnh Trị","Xã Thạnh Trị, Tỉnh Vĩnh Long",thanh-tri,commune,24
01561,"Bình Phước","Xã Bình Phước, Tỉnh Vĩnh Long",binh-phuoc,commune,24
01567,"Mỹ Chánh Hòa","Xã Mỹ Chánh Hòa, Tỉnh Vĩnh Long",my-chanh-hoa,commune,24
01574,"Mỹ Thuận","Xã Mỹ Thuận, Tỉnh Vĩnh Long",my-thuan,commune,24
01580,"Quới An","Xã Quới An, Tỉnh Vĩnh Long",quoi-an,commune,24
01587,"Cầu Ngang","Xã Cầu Ngang, Tỉnh Vĩnh Long",cau-ngang,commune,24
01591,"An Ngãi Trung","Xã An Ngãi Trung, Tỉnh Vĩnh Long",an-ngai-trung,commune,24
01615,"Lộc Thuận","Xã Lộc Thuận, Tỉnh Vĩnh Long",loc-thuan,commune,24
01620,"Phú Tân","Phường Phú Tân, Tỉnh Vĩnh Long",phu-tan,ward,24
01632,"Châu Hòa","Xã Châu Hòa, Tỉnh Vĩnh Long",chau-hoa,commune,24
01633,"Hiếu Phụng","Xã Hiếu Phụng, Tỉnh Vĩnh Long",hieu-phung,commune,24
01640,"An Qui","Xã An Qui, Tỉnh Vĩnh Long",an-qui,commune,24
01648,"Hùng Hòa","Xã Hùng Hòa, Tỉnh Vĩnh Long",hung-hoa,commune,24
01692,"Hưng Khánh Trung","Xã Hưng Khánh Trung, Tỉnh Vĩnh Long",hung-khanh-trung,commune,24
01709,"An Phú Tân","Xã An Phú Tân, Tỉnh Vĩnh Long",an-phu-tan,commune,24
01718,"Trung Ngãi","Xã Trung Ngãi, Tỉnh Vĩnh Long",trung-ngai,commune,24
01720,"Phước Long","Xã Phước Long, Tỉnh Vĩnh Long",phuoc-long,commune,24
01799,"Tân Long Hội","Xã Tân Long Hội, Tỉnh Vĩnh Long",tan-long-hoi,commune,24
01802,"Quới Thiện","Xã Quới Thiện, Tỉnh Vĩnh Long",quoi-thien,commune,24
01824,"Lương Hòa","Xã Lương Hòa, Tỉnh Vĩnh Long",luong-hoa,commune,24
01851,"Lương Phú","Xã Lương Phú, Tỉnh Vĩnh Long",luong-phu,commune,24
01867,"Mỹ Long","Xã Mỹ Long, Tỉnh Vĩnh Long",my-long,commune,24
01868,"Hòa Thuận","Phường Hòa Thuận, Tỉnh Vĩnh Long",hoa-thuan,ward,24
01883,"Bảo Thạnh","Xã Bảo Thạnh, Tỉnh Vĩnh Long",bao-thanh,commune,24
01951,"Duyên Hải","Phường Duyên Hải, Tỉnh Vĩnh Long",duyen-hai,ward,24
02029,"Lục Sỹ Thành","Xã Lục Sỹ Thành, Tỉnh Vĩnh Long",luc-sy-thanh,commune,24
02047,"Châu Hưng","Xã Châu Hưng, Tỉnh Vĩnh Long",chau-hung,commune,24
02093,"Đại An","Xã Đại An, Tỉnh Vĩnh Long",ai-an,commune,24
02186,"Thạnh Phước","Xã Thạnh Phước, Tỉnh Vĩnh Long",thanh-phuoc,commune,24
02207,"Thới Thuận","Xã Thới Thuận, Tỉnh Vĩnh Long",thoi-thuan,commune,24
02247,"Thạnh Phong","Xã Thạnh Phong, Tỉnh Vĩnh Long",thanh-phong,commune,24
02373,"Thạnh Hải","Xã Thạnh Hải, Tỉnh Vĩnh Long",thanh-hai,commune,24
02469,"Phú Thuận","Xã Phú Thuận, Tỉnh Vĩnh Long",phu-thuan,commune,24
02472,"Hòa Minh","Xã Hòa Minh, Tỉnh Vĩnh Long",hoa-minh,commune,24
02500,"Long Vĩnh","Xã Long Vĩnh, Tỉnh Vĩnh Long",long-vinh,commune,24
02518,"Trường Long Hòa","Phường Trường Long Hòa, Tỉnh Vĩnh Long",truong-long-hoa,ward,24
02566,"Long Thành","Xã Long Thành, Tỉnh Vĩnh Long",long-thanh,commune,24
02574,"Long Hữu","Xã Long Hữu, Tỉnh Vĩnh Long",long-huu,commune,24
02643,"Đông Hải","Xã Đông Hải, Tỉnh Vĩnh Long",ong-hai,commune,24
02696,"Long Hòa","Xã Long Hòa, Tỉnh Vĩnh Long",long-hoa,commune,24