code,name,fullName,slug,type,provinceCode
00255,"Minh Xuân","Phường Minh Xuân, Tỉnh Tuyên Quang",minh-xuan,ward,34
00784,"An Tường","Phường An Tường, Tỉnh Tuyên Quang",an-tuong,ward,34
00826,"Sơn Dương","Xã Sơn Dương, Tỉnh Tuyên Quang",son-duong,commune,34
01254,"Bắc Quang","Xã Bắc Quang, Tỉnh Tuyên Quang",bac-quang,commune,34
01293,"Hà Giang 2","Phường Hà Giang 2, Tỉnh Tuyên Quang",ha-giang-2,ward,34
01399,"Yên Sơn","Xã Yên Sơn, Tỉnh Tuyên Quang",yen-son,commune,34
01408,"Mỹ Lâm","Phường Mỹ Lâm, Tỉnh Tuyên Quang",my-lam,ward,34
01493,"Chiêm Hoá","Xã Chiêm Hoá, Tỉnh Tuyên Quang",chiem-hoa,commune,34
01553,"Hàm Yên","Xã Hàm Yên, Tỉnh Tuyên Quang",ham-yen,commune,34
01645,"Sơn Thuỷ","Xã Sơn Thuỷ, Tỉnh Tuyên Quang",son-thuy,commune,34
01719,"Phú Lương","Xã Phú Lương, Tỉnh Tuyên Quang",phu-luong,commune,34
01785,"Yên Minh","Xã Yên Minh, Tỉnh Tuyên Quang",yen-minh,commune,34
01820,"Đồng Văn","Xã Đồng Văn, Tỉnh Tuyên Quang",dong-van,commune,34
01955,"Bình Ca","Xã Bình Ca, Tỉnh Tuyên Quang",binh-ca,commune,34
01989,"Vị Xuyên","Xã Vị Xuyên, Tỉnh Tuyên Quang",vi-xuyen,commune,34
02085,"Khâu Vai","Xã Khâu Vai, Tỉnh Tuyên Quang",khau-vai,commune,34
02146,"Nhữ Khê","Xã Nhữ Khê, Tỉnh Tuyên Quang",nhu-khe,commune,34
02150,"Linh Hồ","Xã Linh Hồ, Tỉnh Tuyên Quang",linh-ho,commune,34
02157,"Hà Giang 1","Phường Hà Giang 1, Tỉnh Tuyên Quang",ha-giang-1,ward,34
02255,"Minh Quang","Xã Minh Quang, Tỉnh Tuyên Quang",minh-quang,commune,34
02264,"Sơn Vĩ","Xã Sơn Vĩ, Tỉnh Tuyên Quang",son-vi,commune,34
02276,"Mèo Vạc","Xã Mèo Vạc, Tỉnh Tuyên Quang",meo-vac,commune,34
02286,"Xín Mần","Xã Xín Mần, Tỉnh Tuyên Quang",xin-man,commune,34
02300,"Hồng Sơn","Xã Hồng Sơn, Tỉnh Tuyên Quang",hong-son,commune,34
02325,"Xuân Vân","Xã Xuân Vân, Tỉnh Tuyên Quang",xuan-van,commune,34
02326,"Mậu Duệ","Xã Mậu Duệ, Tỉnh Tuyên Quang",mau-due,commune,34
02338,"Tân Thanh","Xã Tân Thanh, Tỉnh Tuyên Quang",tan-thanh,commune,34
02354,"Bình Thuận","Phường Bình Thuận, Tỉnh Tuyên Quang",binh-thuan,ward,34
02366,"Quản Bạ","Xã Quản Bạ, Tỉnh Tuyên Quang",quan-ba,commune,34
02371,"Đồng Yên","Xã Đồng Yên, Tỉnh Tuyên Quang",dong-yen,commune,34
02372,"Thái Hoà","Xã Thái Hoà, Tỉnh Tuyên Quang",thai-hoa,commune,34
02385,"Đông Thọ","Xã Đông Thọ, Tỉnh Tuyên Quang",dong-tho,commune,34
02394,"Bình Xa","Xã Bình Xa, Tỉnh Tuyên Quang",binh-xa,commune,34
02417,"Trường Sinh","Xã Trường Sinh, Tỉnh Tuyên Quang",truong-sinh,commune,34
02438,"Nà Hang","Xã Nà Hang, Tỉnh Tuyên Quang",na-hang,commune,34
02449,"Hùng An","Xã Hùng An, Tỉnh Tuyên Quang",hung-an,commune,34
02471,"Kim Bình","Xã Kim Bình, Tỉnh Tuyên Quang",kim-binh,commune,34
02474,"Sà Phìn","Xã Sà Phìn, Tỉnh Tuyên Quang",sa-phin,commune,34
02491,"Bằng Hành","Xã Bằng Hành, Tỉnh Tuyên Quang",bang-hanh,commune,34
02493,"Lũng Phìn","Xã Lũng Phìn, Tỉnh Tuyên Quang",lung-phin,commune,34
02497,"Thắng Mố","Xã Thắng Mố, Tỉnh Tuyên Quang",thang-mo,commune,34
02499,"Thái Sơn","Xã Thái Sơn, Tỉnh Tuyên Quang",thai-son,commune,34
02517,"Phù Lưu","Xã Phù Lưu, Tỉnh Tuyên Quang",phu-luu,commune,34
02532,"Yên Nguyên","Xã Yên Nguyên, Tỉnh Tuyên Quang",yen-nguyen,commune,34
02545,"Du Già","Xã Du Già, Tỉnh Tuyên Quang",du-gia,commune,34
02548,"Pà Vầy Sủ","Xã Pà Vầy Sủ, Tỉnh Tuyên Quang",pa-vay-su,commune,34
02557,"Hoàng Su Phì","Xã Hoàng Su Phì, Tỉnh Tuyên Quang",hoang-su-phi,commune,34
02560,"Phố Bảng","Xã Phố Bảng, Tỉnh Tuyên Quang",pho-bang,commune,34
02568,"Nông Tiến","Phường Nông Tiến, Tỉnh Tuyên Quang",nong-tien,ward,34
02576,"Bạch Xa","Xã Bạch Xa, Tỉnh Tuyên Quang",bach-xa,commune,34
02581,"Tân Mỹ","Xã Tân Mỹ, Tỉnh Tuyên Quang",tan-my,commune,34
02583,"Lũng Cú","Xã Lũng Cú, Tỉnh Tuyên Quang",lung-cu,commune,34
02598,"Tân Trào","Xã Tân Trào, Tỉnh Tuyên Quang",tan-trao,commune,34
02602,"Yên Phú","Xã Yên Phú, Tỉnh Tuyên Quang",yen-phu,commune,34
02631,"Đường Thượng","Xã Đường Thượng, Tỉnh Tuyên Quang",duong-thuong,commune,34
02642,"Tiên Yên","Xã Tiên Yên, Tỉnh Tuyên Quang",tien-yen,commune,34
02672,"Thái Bình","Xã Thái Bình, Tỉnh Tuyên Quang",thai-binh,commune,34
02689,"Minh Thanh","Xã Minh Thanh, Tỉnh Tuyên Quang",minh-thanh,commune,34
02700,"Hoà An","Xã Hoà An, Tỉnh Tuyên Quang",hoa-an,commune,34
02707,"Bắc Mê","Xã Bắc Mê, Tỉnh Tuyên Quang",bac-me,commune,34
02724,"Bạch Đích","Xã Bạch Đích, Tỉnh Tuyên Quang",bach-dich,commune,34
02738,"Sủng Máng","Xã Sủng Máng, Tỉnh Tuyên Quang",sung-mang,commune,34
02749,"Tân Quang","Xã Tân Quang, Tỉnh Tuyên Quang",tan-quang,commune,34
02753,"Lâm Bình","Xã Lâm Bình, Tỉnh Tuyên Quang",lam-binh,commune,34
02758,"Trung Thịnh","Xã Trung Thịnh, Tỉnh Tuyên Quang",trung-thinh,commune,34
02760,"Phú Linh","Xã Phú Linh, Tỉnh Tuyên Quang",phu-linh,commune,34
02763,"Niêm Sơn","Xã Niêm Sơn, Tỉnh Tuyên Quang",niem-son,commune,34
02765,"Bằng Lang","Xã Bằng Lang, Tỉnh Tuyên Quang",bang-lang,commune,34
02774,"Vĩnh Tuy","Xã Vĩnh Tuy, Tỉnh Tuyên Quang",vinh-tuy,commune,34
02781,"Nấm Dẩn","Xã Nấm Dẩn, Tỉnh Tuyên Quang",nam-dan,commune,34
02794,"Đường Hồng","Xã Đường Hồng, Tỉnh Tuyên Quang",duong-hong,commune,34
02817,"Hồng Thái","Xã Hồng Thái, Tỉnh Tuyên Quang",hong-thai,commune,34
02820,"Tùng Vài","Xã Tùng Vài, Tỉnh Tuyên Quang",tung-vai,commune,34
02834,"Tân An","Xã Tân An, Tỉnh Tuyên Quang",tan-an,commune,34
02841,"Lực Hành","Xã Lực Hành, Tỉnh Tuyên Quang",luc-hanh,commune,34
02844,"Tân Long","Xã Tân Long, Tỉnh Tuyên Quang",tan-long,commune,34
02845,"Lùng Tám","Xã Lùng Tám, Tỉnh Tuyên Quang",lung-tam,commune,34
02847,"Trung Sơn","Xã Trung Sơn, Tỉnh Tuyên Quang",trung-son,commune,34
02851,"Hùng Lợi","Xã Hùng Lợi, Tỉnh Tuyên Quang",hung-loi,commune,34
02862,"Tân Trịnh","Xã Tân Trịnh, Tỉnh Tuyên Quang",tan-trinh,commune,34
02873,"Quang Bình","Xã Quang Bình, Tỉnh Tuyên Quang",quang-binh,commune,34
02874,"Đồng Tâm","Xã Đồng Tâm, Tỉnh Tuyên Quang",dong-tam,commune,34
02880,"Liên Hiệp","Xã Liên Hiệp, Tỉnh Tuyên Quang",lien-hiep,commune,34
02889,"Tân Tiến","Xã Tân Tiến, Tỉnh Tuyên Quang",tan-tien,commune,34
02892,"Hùng Đức","Xã Hùng Đức, Tỉnh Tuyên Quang",hung-duc,commune,34
02900,"Yên Lập","Xã Yên Lập, Tỉnh Tuyên Quang",yen-lap,commune,34
02903,"Bình An","Xã Bình An, Tỉnh Tuyên Quang",binh-an,commune,34
02920,"Ngọc Long","Xã Ngọc Long, Tỉnh Tuyên Quang",ngoc-long,commune,34
02926,"Nghĩa Thuận","Xã Nghĩa Thuận, Tỉnh Tuyên Quang",nghia-thuan,commune,34
02928,"Thượng Lâm","Xã Thượng Lâm, Tỉnh Tuyên Quang",thuong-lam,commune,34
02932,"Cán Tỷ","Xã Cán Tỷ, Tỉnh Tuyên Quang",can-ty,commune,34
02934,"Bản Máy","Xã Bản Máy, Tỉnh Tuyên Quang",ban-may,commune,34
02936,"Yên Cường","Xã Yên Cường, Tỉnh Tuyên Quang",yen-cuong,commune,34
02940,"Bạch Ngọc","Xã Bạch Ngọc, Tỉnh Tuyên Quang",bach-ngoc,commune,34
02966,"Kiên Đài","Xã Kiên Đài, Tỉnh Tuyên Quang",kien-dai,commune,34
02978,"Xuân Giang","Xã Xuân Giang, Tỉnh Tuyên Quang",xuan-giang,commune,34
03013,"Hồ Thầu","Xã Hồ Thầu, Tỉnh Tuyên Quang",ho-thau,commune,34
03017,"Tri Phú","Xã Tri Phú, Tỉnh Tuyên Quang",tri-phu,commune,34
03024,"Nậm Dịch","Xã Nậm Dịch, Tỉnh Tuyên Quang",nam-dich,commune,34
03044,"Trung Hà","Xã Trung Hà, Tỉnh Tuyên Quang",trung-ha,commune,34
03050,"Tùng Bá","Xã Tùng Bá, Tỉnh Tuyên Quang",tung-ba,commune,34
03061,"Khuôn Lùng","Xã Khuôn Lùng, Tỉnh Tuyên Quang",khuon-lung,commune,34
03066,"Thuận Hoà","Xã Thuận Hoà, Tỉnh Tuyên Quang",thuan-hoa,commune,34
03067,"Minh Ngọc","Xã Minh Ngọc, Tỉnh Tuyên Quang",minh-ngoc,commune,34
03068,"Ngọc Đường","Xã Ngọc Đường, Tỉnh Tuyên Quang",ngoc-duong,commune,34
03072,"Tát Ngà","Xã Tát Ngà, Tỉnh Tuyên Quang",tat-nga,commune,34
03074,"Minh Sơn","Xã Minh Sơn, Tỉnh Tuyên Quang",minh-son,commune,34
03079,"Thàng Tín","Xã Thàng Tín, Tỉnh Tuyên Quang",thang-tin,commune,34
03087,"Minh Tân","Xã Minh Tân, Tỉnh Tuyên Quang",minh-tan,commune,34
03101,"Yên Hoa","Xã Yên Hoa, Tỉnh Tuyên Quang",yen-hoa,commune,34
03112,"Thượng Nông","Xã Thượng Nông, Tỉnh Tuyên Quang",thuong-nong,commune,34
03136,"Kiến Thiết","Xã Kiến Thiết, Tỉnh Tuyên Quang",kien-thiet,commune,34
03169,"Việt Lâm","Xã Việt Lâm, Tỉnh Tuyên Quang",viet-lam,commune,34
03174,"Thanh Thuỷ","Xã Thanh Thuỷ, Tỉnh Tuyên Quang",thanh-thuy,commune,34
03181,"Thông Nguyên","Xã Thông Nguyên, Tỉnh Tuyên Quang",thong-nguyen,commune,34
03182,"Pờ Ly Ngài","Xã Pờ Ly Ngài, Tỉnh Tuyên Quang",po-ly-ngai,commune,34
03183,"Giáp Trung","Xã Giáp Trung, Tỉnh Tuyên Quang",giap-trung,commune,34
03185,"Thượng Sơn","Xã Thượng Sơn, Tỉnh Tuyên Quang",thuong-son,commune,34
03203,"Quảng Nguyên","Xã Quảng Nguyên, Tỉnh Tuyên Quang",quang-nguyen,commune,34
03218,"Yên Thành","Xã Yên Thành, Tỉnh Tuyên Quang",yen-thanh,commune,34
03219,"Côn Lôn","Xã Côn Lôn, Tỉnh Tuyên Quang",con-lon,commune,34
03257,"Tiên Nguyên","Xã Tiên Nguyên, Tỉnh Tuyên Quang",tien-nguyen,commune,34
03268,"Lao Chải","Xã Lao Chải, Tỉnh Tuyên Quang",lao-chai,commune,34
03281,"Cao Bồ","Xã Cao Bồ, Tỉnh Tuyên Quang",cao-bo,commune,34